title,stocks
For those with some same stocks across multiple brokerages - how do you make timely trades across brokerages?,1
stock portfolio,1
Need to double for down payment,1
Global Electrification Plays,1
$UGA - Hurricane Ida Play,1
Ernst russ container ships,1
I made a spreadsheet to help myself a better long-term investor,1
my friend helped me gain 10x over my investment on defi space by referring me to an platform called earlycoins,1
ROOTing for ROOT,1
Buying an ADR vs the stock itself?,1
Does this work the way I think it works in my head?,1
What app is best for a Canadian noob?,1
"Should I be scared, that I can't withdraw my money?",1
Are stock trading apps somehow scam?!,1
Are stock trading apps scam?!,1
UPLCQ ONLY 1 CENT HEADED TO .50 CENTS TODAY!! Going to have Massive runs 🏃‍♂️ and Huge Volume today !! Charts setting up!!!!,1
What should I invest in?,1
Small win for me,1
Covid results of Amarin's drug this Sun Aug 29th at ESC Congress,1
Are stock trading apps a scam?!,1
"Wall Street Week Ahead for the trading week beginning August 30th, 2021",1
Has following stocks-related subreddits been helpful or harmful?,1
Ernst russ Today's course 3.5 euros 20EURO next year? ! 🚢💸,1
Robinhood sucks?,1
Timing the market best for a bear market?,1
$50. What would you buy?,1
how do i get into stocks?,1
How to buy this stock? thank you 4 your help.,1
How to Start a Hedge Fund from Scratch? Hedge Fund Manager Interview,1
YouTube more valuable than Netflix?? But is the stock price of GOOG valuing it?,1
What's your annualized return over last 5 years?,1
Looking to get more aggressive with investing. Suggestions/Advice?,1
DOCUsign stock: Good long term hold or just a pandemic beneficiary?,1
Coinbase Trading,1
Affirm jumps after Amazon partnership news,1
How often do you inject money into your portfolio?,1
Let’s talk about something we don’t normally talk about ... but what is it?,1
401k question,1
Guys (and gals) I'm getting nervous!,1
Are there any prop firms which allow stock trading for all stocks listed in the NYSE?,1
$ATER is heading back to its 52 week high over the next two weeks,1
What app should i use for stocks?,1
Compiling a list of subreddit for data analysis,1
Microsoft vs Facebook,1
Compiling a list of subreddits for data analysis,1
Any Thoughts on Recurring Investment?,1
What happened to SPRT?,1
Why did the markets rally today if everyone's so worried now?,1
$1700 portfolio Tesla decision,1
Taper tantrum 2013? I see nothing on sp500 chart,1
Be your own hero! Link with instructions on how to verify insider ownership of any public company.,1
Be your own hero! Link with instructions on how to verify insider ownership of a public company. 👇🧠,1
"If you had $5000 to invest in a stable stock over a 1-2 year timeline, what would it be?",1
"I am 20 years old, what stocks should I invest in for my future???",1
"With some many companies with high evaluations and so many going public, which do you see going bankrupt in the next few years?",1
$CRTD Discussion,1
Kids and stocks,1
Does anyone have any information on Thistle Mining Inc?,1
What do you guys think of the stock of PINS?,1
Trying to figure out why this happened!?!?!?,1
Short squeezes every where I think,1
What would happen if the pandemic ended in 2024?,1
Best space ETF?,1
$XOM Why is it hurting,1
How much to give those handling your investments earned from the total profit?,1
Rivian’s value to Ford?,1
What makes you think SoFi is better/worse than its competitors?,1
Seeking advice on stock research tool FASTGraphs,1
How will the end of the evictions pause effect the market?,1
Are MER fees reflected in the stock prices?,1
Question about Taxes on Covered Calls,1
Amazon is a buy with 10%+ opportunity,1
CAGR for stock market returns greater if you contribute a fixed monthly?,1
$20k covered call plays,1
This Guy Created A Really Good Investing Subreddit,1
"Amazon partners with Affirm to roll out first buy now, pay later option on the e-commerce site",1
Suggestions for portfolio tracking apps?,1
New Beginnings,1
New to the market,1
"Here is a Market Recap for today Friday, August 27, 2021",1
"Support.com... and ""Short squeezes""",1
WMT setup looks juicy,1
Best investment for kids,1
"If a stock gets to a certain share price and then we correct, is there a good chance it'll get back to that price some day?",1
"Looking to invest small drips of money into stocks, (£30-50) per month. Recommendations?",1
fuck me in the ass. I love jesus,1
Suggestions for portfolio trackers?,1
Looking for stock(s) to drip small amounts of money into each month (£30-50),1
"My girlfriend wants to start investing little amounts of money each month, any recommendations for long term growth?",1
Cost undervalued still,1
Any discord servers for female traders?,1
Help me invest my kids allowance,1
"When this legendary 13 year run collapses, if a party is cash, how long will you have to react during the flash? Will limits only fill?",1
Cielo Waste solutions,1
Continue to save for a house or put money in VTI/VOO?,1
Make money simple,1
Global X Launches Six Options-Based ETFs for Current Market Environments,1
"$AHT is on the rise, and it will go on",1
Go to the moon with me on NDAX!!!,1
Thoughts on SentinelOne? (cybersecurity),1
"SPRT is going crazy, pls explain…",1
A random walk down wall street VS Up on wall street,1
"MKTY, the undiscovered biggest competitor of Riot and Mara",1
How do I get started?,1
$M12 – german beauty pearl - M1 Kliniken AG,1
"Damn ! BMW is testing LiDAR sensors from Innoviz Tech ($INVZ) , get ready to pop 🚀 🚀 🚀",1
Question pertaining to daily returns.,1
Question for Freetrade investors - which stocks do you invest in and why?,1
Discord Server with free Alerts and Education on TA !,1
Is $JOBY about to take off? i just found this article. wondering what you guys think,1
"Hi reddit, investing 100 a week in VOO",1
"SPRT is up almost 200% in a single day, Anyone know why this is happening?",1
How can I receive interest on my stocks? Can I lend them out? Is there a way to get additional income out of them?,1
Is there a way to lend out stocks?,1
Is it worth to invest 5000$ in index funds for 1-2 years now?,1
Options question?,1
Question for FIB Charts experts,1
Best way to salvage LK/LKNCY stock?,1
ETF vs Mutual fund,1
What stocks you would suggest to a Fledgling Trader on their first day?,1
Taper Tantrum 2.0?,1
Himx 12% short interest earning $2.50 this year and $2.70 next year trading @ a P/E of 5,1
Does anyone have insight on Synopsis?,1
Thoughts on Zoom ($ZM)?,1
How to calculate NAV for REITs?,1
Just another great day for $BB news,1
Nakd share holders,1
Good time to buy NVDA ?,1
A HUGE 🏆 OTC UNDER A CENT HEADED TO $3.50 TARGET PRICE BY TOP BROKERS IS PHIL $PHIL BUY U WILL BE A MULTI MILLIONAIRE,1
Good time to buy NVDA?,1
Newbie to stocks what stocks should I buy for best dividend return and which platform should i use if i live in Australia,1
Am I insane for investing $400 every month?,1
Opinions on this ?,1
ASTA (astra verda Corp),1
"Rivian Files for IPO, Seeking About $80 Billion Valuation - Bloomberg",1
Whats that website called that lets you see what stocks Congress people are buying?,1
"If you had put $3,000 into this stock back in 2019, then you would’ve hat $63,000!",1
Powell Says Fed Could Start Scaling Back Stimulus This Year,1
What just happened to SPRT?,1
Grayscale Litecoin Trust (LTCN),1
Rivian files for IPO,1
Any brokers let you trade multiple accounts simultaneously?,1
Any thoughts about pfizer stock?,1
Free resource to get notified of new analyst price targets,1
Short Term High Yield Bond ETFs,1
VectorVest app,1
Why is Disney’s PE ratio so high at $288.92. How is that even a good thing when it’s known that a PE ration is good from around $15/20- $25?,1
Is anybody trading Luicd ?,1
"Get a stock, how?",1
Looking for a stock that will BLOW UP,1
Any of ya'll know shit about NFT's,1
which purchase lot of a stock do you sell to offset short term capital gains?,1
In Powell we trust,1
a quick newbie question about offsetting short term gain with a loss,1
The Party Keeps on Goin!,1
5 stocks to buy and hold it for 10 years?,1
All imma say is keep your eye out for $A👀 (Agilent Tech.),1
Thoughts on shorting GE?,1
$PHUN #Phunware Launches #PhunCoin,1
Shorting GE - thoughts?,1
Charles Payne mentioned BLNK Charging yesterday. I looked into them,1
AMGN getting news and is undervalued bullish descending wedge,1
BABAIs it worth buying at the bottom?,1
AUPH stock on fire,1
"AUPH: Best treatment against Lupus nephritis, undervalued, buyout candidate and high level of short interest",1
"Morning Update for Friday, 08/27/21",1
Pharming biopharmaceutical company,1
"r/Stocks Daily Thread on Meme Stocks Friday - Aug 27, 2021",1
What are the chances of a MSFT split in the next few years?,1
Which etf's and stocks are good right now and should you buy. And why?,1
(ALI BABA) BABA,1
Problems with retail trading...,1
Any stock/etf related to china real estate/financial on US market?,1
COVID Stocks,1
Any stock/etf related to China real estate/financial market to short?,1
Which ETFs to buy and hold for long-term,1
"r/Stocks Daily Discussion &amp; Fundamentals Friday Aug 27, 2021",1
Free Trade : Free random shares,1
Thetradercave.com,1
Where to find NAV for REITs?,1
Seeking 401k advice,1
Hello Stock People,1
XEQT or VFV?,1
"Official news from Xinhua ""Private, foreign companies not target of China's internet platform regulation: Official""",1
[Request] API or download for market data?,1
Ok folks: Give me your top cybersecurity stocks that 6 months from now will outperform the rest.,1
New to buying stocks any advice?,1
"Looking for stock advice, any contacts, and new friends in Jersey who are into shit like this like I am.",1
Young entrepreneur,1
Stock site that reports the % gained loss per day on a daily basis?,1
Current state of the markets,1
How would you invest if you were in your 20s?,1
"Vector acquisition successfully got swapped to RKLB in my account, but the value is showing as zero?",1
"How many stocks do you keep in your watchlist at any given time? Do you like to have a lot, or just a few, how do you manage your list, etc?",1
How much cash to have in my stock portfolio,1
On The Joe Rogan Experience Amarin's drug Vascepa talked about,1
We need a tool/viewer/matrix to fiddle/play odds with S&amp;P 500 companies to realistically gauge drawdowns,1
How would I invest $75K in liquid cash and about $25K in company stocks?,1
"Is the semiconductor/processor industry (NVDA, AMD, TSM, QCOM) a no-brainer investment for a 10+ yr time frame?",1
Is AAPL in an endless rally?,1
"Anytime someone asks ""Crash?"", it means stocks will NOT crash",1
Best picks for renewable energy?,1
"Why is the ""cost"" of my put option increasing?",1
IMO: Religion will be obsolete in 30 years,1
I don't understand this sentence in an article about Bollinger bands.,1
"IBRX, Immunitybio, 72% Complete Response for bladder cancer",1
Advice for a 17 year old kid,1
A game to test whether beginner is ready to invest or not,1
How do I convince the guy on the phone at Charles Schwab to approve me for level 1 options?,1
"Immunity bio, IBRX, over shorted?",1
"IBRX - Immunitybio, possible short squeeze",1
How to interpret mm’s manipulation?,1
Great things hapoening at REKR,1
what are your thoughts on RKLB stock?,1
A question about options,1
if i had to put all my money in 1 stock for big gains in the next week what would it be? top comment i put all money into at open and post,1
TQQQ vs BTC some thoughts and questions,1
$RTON / Endo Brands,1
Feedback about an app I'm developing with friends (portfolio tracker),1
Cara Therapeutics looks like a buy,1
Warren Buffett: How I would invest if i wasn’t a billionaire,1
Why are spacs hated on so much?,1
ZEV-the future that was left behind,1
Any significance to “analyst price targets”,1
Is what Silvergate Bank ($SI) doing of collateralizing their super volatile assets a risky formula?,1
"Brick wall, Ferris wheel, or escalator down?",1
Advice request,1
Thoughts on AAPL right now?,1
The Competition Is Coming,1
"Gap, AnF, and Urban. how did they diverge?",1
Is it super risky to be using bitcoin (a volatile asset) as asset collateral? Seems like what Silvergate ($SI) is doing,1
Reputable sites?,1
"Here is a Market Recap for today Thursday, August 26, 2021",1
INTC vs NVDA,1
"Why are BONDS recommended as a SAFE investment, yet they also CRASHED during the 2020 Stock Market Crash?",1
What’s up with Visa (V) and why are some analysts predict it can gain +25% in the next 3-6 months?,1
Market-relative visual momentary analysis app?,1
Sorry for breaking rules but it’s important,1
"ETFs and Index Funds, what to consider when buying?",1
Looking to enter SPACE horizons. Any stock suggestions? (7Y+ investment),1
ZEV- the future that was left behind,1
Thoughts!!!!,1
"Anyone keeping an eye on any of the following? TALK, VIOT, AEI? At or nearing attractive entry points?",1
"Anyone keeping an eye on any of the following? TALK, VIOT, VRYYF, MNMD, AEI? At or nearing attractive entry points?",1
CNBC does it again.,1
"Peloton shares tank after wider-than-expected loss, slowing sales growth",1
High Dividend REIT stocks and Other Dividend-Heavy Investments,1
Best app to buy stocks?,1
Another pop and drop right after a good report for ZUO,1
Bear case for Amazon(AMZN)?,1
crash because of high leverage,1
Starting out! Got my eyes on these - is it a good time or should I wait?,1
"I am a college student i learned a bit about investing in my class, im looking for cheap stocks according to my budget any recommendations",1
How do you transfer stocks from cashapp to fidelity?,1
Any thoughts on Support.com stock?,1
Why Tkat is an pump and dump,1
Why is China attacking its big techs?,1
Oscar Health as a disruptive health insurance play. Huge potential,1
Portfolio Tracking w/ Charts?,1
$Adap$$$$$$$$,1
DYNAVAX stock prediction.....,1
Portfolio tracking similar to RH?,1
Question put option,1
A HUGE 🏆 OTC UNDER A CENT HEADED TO $3.50 TARGET PRICE BY TOP BROKERS ON WALL STREET IS PHIL $PHIL BUY U WILL BE A MULTI MILLIONAIRE,1
$DKS dividend play,1
Home Furnishings and such!,1
How do you find stocks to look morgon in to?,1
Microsoft and Nvidia Options. Losing and looking for advice,1
When should I sell?,1
Lucid Motors,1
Salesforce long term growth,1
"Rescue plan, feedback appreciated",1
Rescue plan!! Feedback please 🙏,1
Go Nordstrom!,1
Go Nordstrom!!!,1
Rolls Royce: the crown jeweled of the U.K,1
Which account to use for small allocation to individual stocks. Taxable or Non-Taxable.,1
Buy Googl or wait in 2021?,1
Buy ZKIN now...,1
Re: Palantir,1
My Grandparents have given me a proposition and I need your help,1
I think apple is gonna break out,1
Grandmas Inheritance,1
Switching brokers,1
portfolio help,1
$PRPO contract announcement,1
Anyone else been following the Krispy Kreme Stock (DNUT)?,1
ASX vs AMKR Question?,1
zom poised for breakout?,1
Which sites do you guys use to get analysis on stocks?,1
When to know to take profits without and not worrying if the price does go up you will miss out?,1
What % of net worth do you guys invest?,1
Virpax VRPX annonces manufacturing and suppe agreement,1
Is $CPNG really worth $31 a share?,1
Broker for Colombia/ Latin America,1
Living off of $100K in $VOO.,1
Shorting AAPL - thoughts?,1
taxes on investment (as a foreinger),1
ZOM is trending,1
Fidelity Dividend Reinvestment,1
Is tesla a good long term buy,1
Is tesla a good long term buy ?,1
Rumored buyout offer on r/SKLZ how about just a hook up to use an online betting license Google Play.,1
QS achieved 800 cycles on 4 layer with &gt;90% energy retention,1
Where to Start as a Beginner,1
CRNT looks like its about to break out,1
CRNT possible break out from here,1
What are your highest conviction stocks that you are holding for 5+ years?,1
etoro vs fbs trader which is better ?,1
Niche high growth stocks with low competition,1
I need some book recommendations,1
"r/Stocks Daily Thread on Meme Stocks Thursday - Aug 26, 2021",1
Japanese stocks - witholding tax - ADR or real?,1
Outstanding research/DD on r/SKLZ,1
XLV vs VHT performance,1
hithreguyswyd,1
Google Owns the Largest Residential Drone delivery service now?? What does this mean for the stock?,1
Could we see another crash like the 1990 Japanese one?,1
Google Owns the Largest Residential drone deliver service acc to Forbes?? What will this mean for the stock?,1
"r/Stocks Daily Discussion &amp; Options Trading Thursday - Aug 26, 2021",1
"So, how do I figure out what the maximum amount of stock I can buy is?",1
SoFi - gauging the general sentiment,1
Dollar cost averaging and compounding,1
Really need help I got a RM call for only 2.05 or liquidate 4x the amount I sold 13 in doge will that be good or no?? Really need help,1
Looking for new Investments,1
Hello Veterans who consistently produce profits - what paths of education or learning did you take?,1
Any idea why GRUB crashed? Looks like a golden mine for me at this point. All info appreciated!,1
Any explanation of the GRUB crash?,1
Investing gone wrong. Need advice.,1
Meme Investing dilemma...,1
Free Tradeview Alternatives For Watchlists,1
Least risky genetics bet,1
Fell for Meme investing. What to do now?,1
"I’d like to ask a question on an earnings call, how do I not sound like an idiot?",1
September IPO’s,1
September IPO's,1
Evergrande EV Unit Loses $80 Billion in World’s Worst Stock Rout,1
Good YouTube channels for macro updates/ stock picks/ interesting topics etc?,1
Can someone help me understand the difference between AMZN and AMZN.NE,1
Stocks for babies.,1
Aerotyne International. A mere $6k investment. Worth it?,1
Is there any catalyst for AT&amp;T stock?,1
How do really rich people keep their stock?,1
"Protect Against Identity Theft, Fraud and a low Credit Score!",1
Figured I'd share my stock portfolio at the age of 14,1
what stocks do you see as undervalued at the moment?,1
How can I legally be a god in wall street?,1
Sell stocks to buy a new car or just finance?,1
Help me get extra credit :),1
I wrote an article on NFTs and what they mean to the stock market,1
🤝Noobtrader🤝,1
Canfor versus West Fraser Timber,1
Is SAM a value buy?,1
Can we stop with the substance-less posts?,1
What indicators for the market do you use daily? (Not TA),1
Electric Car Supplier Futures,1
Question about triple leveraged ETFS,1
Just need some advice,1
Any milk crate stocks I can invest in???,1
We call upon Reddit to take action against the rampant Coronavirus misinformation on their website.,1
What is you opinion (or experience) on (with) REITs ?,1
Is there any way for me to buy this stock “3VM1.F” here in the US?,1
How do I value long-term warrants?,1
where is a list of delisted stocks?,1
Spy Credit Spreads,1
Mortgage or Index funds?,1
When should I sell my Stocks?,1
What does a step ladder trend indicate?,1
USA and Canada are about to get major market presence with the Mike Tyson Iron Energy Drink. LeanLife Health News today LLP / LNLHF.,1
How to buy home with stocks (retirement),1
Cyber Security Stock Picks,1
Newbie to the stock market here.,1
SEC Chief Warns ‘Clock Is Ticking’ on Delisting Chinese Stocks,1
"Finviz ""Unusual Volume Signal"" Formula",1
Anyone have thoughts on peloton earnings?,1
Help! I literally am so confused,1
How to value a stock?,1
Zomedica Corp. $$$,1
My friend wants me to invest his money...,1
I am looking for a hot trade..have major bills coming up,1
AGC - soon to be Grab,1
Virtually empty level 2. Can someone explain this to me?,1
Thoughts on DHS?,1
What percentage of traders are active during after hours?,1
BUG vs CIBR?,1
The Montana Deal Is Here. *CLMT*,1
"Have you read the book ""Fooled by Randomness"" and has it changed the way you invest?",1
I’m a teen looking for insight,1
What’s the better cybersecurity play: MSFT or GOOG?,1
Equation needed/excel,1
Policy and interest rate risk,1
iShares by Blackrock,1
What percentage of your portfolio consists of funds available to spend?,1
Is going all in on VTI as a 20 year old a bad move?,1
"How Would You Invest the First $2,500?",1
Stock App For Option,1
What are your thoughts on the ASML stock?,1
Looling to invest in $SYTA,1
brokerage help,1
brokerage help.,1
Where to get earliest phase three results for pharma companies?,1
"Low P/E Ratio, good or bad?",1
$SYTA - Siyata Mobile Inc,1
Why isn't anyone talking about EXPR???,1
Need advice to invest with only 100 bucks per month,1
SPDR S&amp;P 500 ETF Trust option call,1
Is there a detailed breakout of Pfizer vaccine sales/contracts?,1
How is it possible to invest in Shanghai stocks exchange if china doesn't allow it,1
$SYTA - Siyata Mobile,1
"SPRT - 75% Short Interest, +19.62% Today",1
Solar names could go up meaningfully due to 3.5 trillion partisan budget reconciliation $RUN $TAN $TSLA,1
"Negg, what do you guys think about it?",1
Salesforce Announces Strong Second Quarter Fiscal 2022 Results; raises guidance to $26.2-26.3B,1
"Here is a Market Recap for today Wednesday, August 25, 2021",1
How do I identify if trading volume is buying or selling pressure?,1
Free Success,1
"Nuvei, long term hold?",1
SPY on Crack This Week WTF?,1
ASX200 P/E vs Earning Yield Newb to stocks but need confirmation if I'm right,1
I made a bot that does true daily dollar cost averaging and have open sourced it,1
Over 100% of institution ownership percentage,1
Palantir (PLTR) insiders sold over 4 million shares between 8/20 - 8/24,1
"I'm thinking about purchasing b2gold, I am in California, will I get charged adr fees every year?",1
question for reddit users,1
If you could only invest in 5 stocks which would they be?,1
Free resource to track analyst price targets,1
Let’s talk about investment analysis sites,1
Western Digital's stock soars after WSJ report of talks on $20+ billion merger deal with Japan's Kioxia,1
Newbie question,1
Which info do companies get from me?,1
IPWR to commercialize disruptive BTRAN tech next year,1
AT&amp;T &amp; Krispy Kreme,1
MTNB Matinas Biopharma ... that title would go to Pluto. It would then navigate past the Voyager 1 probe and travel into interstellar space.,1
"How to open a brokerage account and get free stocks, Open and fund your account to receive free stock",1
How do long term stocks help ?,1
Might be time to buy Wayfair,1
"Uber is making headlines again, A California judge struck down Proposition 22",1
AWSHX mutual fund,1
Thoughts on SPRT Reverse Merger with Greenidge?,1
Why Is Everyone Talking About Uber Stock? - article,1
Will Moderna peak again before the vaccine’s approval?,1
American Funds Washington Mutual Investors Fund Class A AWSHX,1
$RKT lawsuits,1
Thoughts on the best Weed Stocks?,1
Looking to invest towards charity. Advice?,1
Hello everyone,1
How do you live off stock portfolio gains?,1
Thoughts on ZEB?,1
Health insurance stocks are gonna make bank,1
HUGE short squeeze opportunity??? ATER,1
Should I actually invest in stocks?,1
Is there a short squeeze on SAVE (Spirit airlines),1
YQ earnings due today,1
Is it worth it to try playing two sides of a foreign stock?,1
Buying stock after company take over.,1
free commission trading is a myth?,1
Is there a short squeeze on SAVE (Spirit Airlines)?,1
Any experience with Ortex signals?,1
What are some of your favourite stocks?,1
MP materials stock: worth a long term hold?,1
Why is NBIX (Neurocrine Biosciences) underperforming despite strong fundamentals and growth?,1
Your thoughts on what to buy and when to sell?,1
Is motley fool worth it or ripoff? Any views ?,1
"If I own Index Funds, should I invest in stocks that are in that fund?",1
Vaxart on the rise,1
Invest in $Wish the stock is super low and looking to make a squeeze,1
First options trades I’ve made that aren’t just speculation,1
SAVA and DLO,1
10 Reasons to Buy $AMZN November Calls Ahead of Earnings (With Proof Of Positions),1
HMLP IS worth at least a look.,1
DKNG options,1
"$10K to invest, thinking etfs, thoughts?",1
Perimeter Medical Imaging AI Provides Corporate Update on Ramp-Up of its Commercial Organization,1
Interested in Pharma stocks recently!,1
Just starting out,1
Got really Interested in Pharma stocks recently!,1
Stock Pattern Signals?,1
Does somebody here own Paynova stocks?,1
'Coffee Can Investing' : Companies with 10% rev growth + 15% ROCE over 5 yrs + strong moat,1
Still in buy the rumor territory on clean energy,1
Uber VS. Lyft,1
Any fud going on with HMPQ?,1
Aurora Cannabis big news check it out...,1
Where would you park some cash right now?,1
ARK Invest - ETF or basically a VC fund?,1
From the latest Pinterest filing...,1
Tips/research about investing in an international arms company,1
Untapped market?,1
Hedge funds with a steep increase closing to new investors?!,1
"r/Stocks Daily Thread on Meme Stocks Wednesday - Aug 25, 2021",1
JOIN r/SuperWallStreet because You can't post about your favorite stock on WSB? SURE. We support you.,1
JOIN r/SuperWallStreet because You can't post about your favorite stock on r/WallStreetBets? SURE. We support you.,1
WTH is wrong with Intel?,1
Backtesting Software,1
How can a Software developer who loves his job too can make a passive income by purchasing shares.,1
Stock Sentiment Analysis Platform,1
run down of the major oil industry,1
"r/Stocks Daily Discussion Wednesday - Aug 25, 2021",1
Share some common technical patterns and explain why AMC are up,1
Help with stocks,1
Swing Trading,1
New and Don’t Know What to Do,1
What about Alkaline Fuel Cell Power(A3CTFYF)?,1
Online Service to time buying and selling,1
$PANW Technical Analysis &amp; Price Levels - Week of August 24,1
When did we allow the IRS to tax us to kingdom come?,1
Looking to create a small discord community.,1
Can someone explain why my options did the opposite of expectation?,1
Looking to create a stock discord with few people!,1
Opium stocks?,1
"Will someone explain Cigna's ""Accelerated Stock Buyback""?",1
