title,stocks
"I feel like this stock is under the radar on reddit. $TAAT, a hemp based cigarette, tobacco and nicotine free alternative looking to disrupt the 814 billions dollars tobacco industry.",0
News on RIDE CEO appointment,0
Friday 4.30pm Wait to see my screen 💎💎💎🦍🦍🦍,0
Kramer thinks MMAT is a metal company. Loony bin Jim 🤦🏻,0
"Life’s battles don’t always go to the stronger or faster man. But sooner or later the man who wins, is the man who thinks he can. #PALIKARAS #MMAT #BRUCELEE",0
Newbie in need of guidance.,0
How much would you set aside?,0
Rate my portfolio! Been investing for 7 years,0
"Not american stocks so maybe ya'll won't like it, but the near 50% profit made me smile today",0
WallStreetBets USA Edition Essential,0
"Really like this Doximity stock. Doximity was grouped in with two other companies that provide similar service, both selling at 800 dollars a share, experts think it can get to that level, and it certainly looks like it’s on the road to. Boost tf out of this apes",0
"I am 17 years old and I am new to investing. This is where I am at, what do you think? These are my three portfolios.",0
Is there any public free list to see all the world stocks classified by % increase?,0
Stop Losses for long term hold to avoid market crash. Selling big winning positions and rebuy it with new stop Loss amount,0
Requiring Tips &amp; Pointers,0
Any thoughts on this week's earnings reports?,0
My 2.5 Year (all time) Performance,0
2.5 year reflection,0
Takeaway into $AMRN's German launch 13 days from now,0
hey i am 16 look my profits,0
The Weekly DD - Skillz Inc (SKLZ - Full Stock Analysis): E-gaming for non-gamers,0
Top 5 Completed Adult Games,0
Utopia Peer-to-Peer Introduces Anonymous USD Stablecoin that will provide fully untraceable transactions that are pegged to the US Dollar,0
I'm wondering where I can find history of analyst forecast for a particular stock? E.g. I'd like to know how analysts estimated APPL stock price at 2015. So something similar to Yahoo Finance but with old forecasts,0
Top Wall Street analysts think these stocks still have major upside after earnings,0
Why I am buying shares in PulteGroup(PHM),0
Hop On the RIDE Before Icahn Shows His Cards,0
"series 7, 57,63 Pdf required",0
International Net-Nets: Alive And Kicking,0
Stocks,0
"22 y/o Beginner Investor Rate My Portfolio, What Should I Add Next? (Note: This is only 15% of my entire portfolio, 70% is in an index fund and another 15% in crypto)",0
"Shorts had their fun with REKR, knocked it way below fair value, time for this coiled spring to 🚀",0
Nintendo stock,0
Is Alibaba a good stock to buy or is it too risky?,0
Bought $affrm 2 weeks ago.. Thinking about my next move for this week. Any thoughts?,0
"The course taught to Wall Street’s top traders. ‘Trading and investing with discipline’. 12 hours of webinars and 6 of Intuitions e-learning modules. Presented to over 40 financial institutions in 16 countries. Process, discipline, self-awareness! Risk management. (15% discount)",0
$SPRT,0
What app do you use to trade both crypto and public stocks?,0
How to withdraw money on Paddy Power,0
Starting my journey into stocks/crypto please feed me your knowledge,0
"Discussion on precious metals - pros and cons of precious metal stocks, ETFs, and physical holdings",0
"Hi team, Any advice on stocks or crypto?",0
How should I precede.,0
Does anyone know where you can trade (most) Vanguard ETFs in Europe?,0
Thinking about the future,0
2 year reflection,0
What is futures trading and what's the point in it?,0
reits are a bad investment,0
Genuine YouTube channel,0
"This is my webbull profile name, does anyone else use webbull? I have 1216 followers for a reason 👍",0
Someone said I was full of shit until I post my YTD earnings. I am a day trader and often withdraw my trades the day of. My YTD is HUGE. These are not all of my trades. I reduced my position from 7300$ down to 2300$ on robinhood because I have 1000$ in margin and I moved to crypto I can't screenshot,0
brand new to investing please help/rate my portfolio,0
Does anyone use Webbull?,0
Hi I’m a market manipulator posing as a teenager on Reddit showing off my portfolio to persuade young investors to see my holdings and invest in those companies. AMA,0
"$BIGG Stock price above Ichimoku Cloud, and has been walking above the Bollinger band. OBV following stock price. BB%B falling (starting to walk under the Bollinger band)",0
Does anyone use webbull?,0
Thoughts on this,0
"Why did Peter Thiel (founder Palantir, eBay...) and Cathy Wood invest so much into CMMB (Chemomab)? Do they know something? It just jumped 20% but it’s 1000% off it’s 8 month high...",0
Best resources to learn investing!,0
Preparing for investing,0
Wall Street Is Looking to Reddit for Investment Advice. Wall Street professionals tell everyday investors what stocks to buy. But now they have to follow some of these amateurs for signs of where the market is headed next.,0
"I am looking for guidance on SLI, any thoughts?",0
TAX DEDUCTION THRU CHARITY,0
Should I invest in the S&amp;P 500 or Apple or Amazon,0
"How does my portfolio look? I’ve had this portfolio for about 2 weeks and I started with 7,500 and now im nearly at 8,000. I’m 18 years old and I’ve been investing for about 7 months total but I was using Robinhood before I switched to TDAmeritrade. Any feedback or advice would be appreciated!",0
"Im just 18, started 1 month ago, any tips, and is there any brokerage that can allow me to day trade.",0
Thoughts on my portfolio? 22yo with long term horizon,0
"Been slowly growing, any recommendations for long term growth? I have mainly been buying from recommendations from people I know, but I've pretty much bought all them so far. Should I try to get more of the ones I have or are there other stocks I should get into? My priority has been dividends",0
Im new asf the the stock market any tips?,0
"I found the strategic treasure, motivation.",0
Brokerage accounts,0
Thoughts on my portfolio? I’m 22 and just started investing in the stock market 2 months ago. Any advice is helpful!,0
Best investing platform for begginer,0
Stocks with the biggest change in sentiment in the news over the last week (8/22 - 8/25),0
Rookie trader looking for guidance,0
The stocks with the most optimistic sentiment within news coverage this week (8/22 - 8/25),0
NAKD going crazy on all social media,0
Do you guys like my portfolio ?,0
Lovely Inu,0
"I’m sure the market was reacting to the Powell speech Friday, but that fact that all my holdings went up simultaneously worries me lol",0
Need website/app to invest in stocks,0
I would like to know your advices to someone who's starting,0
The recent surge in “Meme” stocks like AMC and Gamestop as the “retail trader sticks it to Wall Street” is not new.,0
I started a news aggregate site called Macrohint.com,0
App,0
2 months into trading at 18 and was wondering on how im doing and what i can do better,0
I’m confident in my fourth portfolio,0
Hey new investor here,0
Any paper trading accounts with fractional shares?,0
How Should U Split Money Ur Putting Into Ur Portfolio?,0
First time posting - thought I’d start with my stonks portfolio,0
Need some advice,0
I’ve been seeing people share what they have and thought I’d join in.,0
PREDICTION: Major Dips Week of 9/11,0
Help!!!,0
With the Fed looking to combat inflation and taper off of stimulus are there any banking plays people are looking into?,0
PREDICTION: S&amp;P 500 Gains Plummet Week of 9/11,0
Work from home,0
GTEH Strong Monday Buy,0
Two part question about paying for trading insights,0
Graham’s Net-Nets,0
What should I buy as a 24yo to get more blue chip stock/etf? I want to be more safe in case of a crash/correction. thx guys,0
Should I cut my loses on my over buys ?,0
My portfolio,0
Reits are bad investments,0
Something that as a newbie cannot quite figure out,0
I've had about enough of RH. Anyone have any experience with SoFi/TD Ameritrade ACAT fee reimbursement?,0
Why you don't want to be rich (and what you should strive to be instead),0
I made a spreadsheet to help myself a better long-term investor,0
my friend helped me gain 10x over my investment on defi space by referring me to an platform called earlycoins.io,0
Why ATARI is my penny stock for the next 3 years,0
What do you guys think of butterfly network?,0
"Older interview - (c)1996 - with Nassim Taleb, from ""Derivatives Strategy."" Even then he was strongly outspoken against VAR modelling: ""You can fool yourself with your Sharpe ratios, and you can fool all of the financial engineers, but you can't fool an old Chicago trader who went bankrupt twice.""",0
Seeking Portfolio Advice (Mid to Long Term),0
Pure luck with some of my profits so far. Still new but would like opinions on what I have.,0
Have been investing for about 2 years now… thoughts on portfolio?,0
Will this recover?,0
"Wall Street Week Ahead for the trading week beginning August 30th, 2021",0
Fundamental Analysis | basic analysis of stocks | Financial statements,0
mutual funds of Tata Digital India Fund Direct Growth | Tata Digital Fund,0
Rebel Daughter,0
Feed for United States!,0
10 STOCKS BILL GATES HAS BEEN BUYING | PORTFOLIO REVEAL| 📈,0
Help Me Understand Leverage Lossed,0
Investing partners salary into TQQQ for an year,0
BBIG,0
New-ish to stock market trading and need advice,0
Will SPAC Stocks Recover? Did Hedge Funds Kill Them?,0
"Work from home, make up to $50k weekly",0
"Can someone explain why the CAGR on this (portfolio visualizer) is crazy high? From 1976-2021, $10K initial then $2K monthly contributions.",0
"I'm 17, rate my diverse portfolio.",0
Real Time Data,0
Summary of Jpow's speech at Jackson Hole,0
Two stocks to watch in the beverage industry,0
The 16 year old Portfolio going after blue chip companies and safe investments any thoughts gonna switch my trading app,0
Looking to learn,0
Where are the Shorts?,0
"Most Anticipated Earnings Releases for the week beginning August 30th, 2021",0
What app should I use for stocks,0
Too much Tech for 25 year old??,0
Several Successful People who did not receive high formal education,0
Strong Monday Buy,0
Books or Podcasts,0
Rate my portfolio!,0
18 and started 4 months ago. How does my portfolio look?,0
"WSB founder, Jaime Rogosinzki, on the next big meme stock.",0
Old(er) people: what was it like trading stocks before the internet?,0
"Are Genomics, Biotech Companies Overvalued? Are We In A Bubble?",0
Watch Fed chair Jerome Powell's full Jackson Hole speech,0
Penny stock Question,0
Wall Street Is Looking to Reddit for Investment Advice,0
AT&amp;T on the ups!,0
"I'm 25 and wanted to start investing for a long time. After hearing a lot about the current bull run, I couldn't resist starting. What do you guys think about my portfolio? Any critical feedback would be appreciated. Thanks",0
For my AMC APES,0
ETFs with Investments in SP500 Winners of 8/27/2021,0
SP500 Winners and Losers | 8/27/2021,0
New and want to get educated on the stock market,0
euro exchange rate for 1000 euros,0
NAKD - Mentioned As Next Big Meme Stock At 19 Minutes 50 Seconds By WSB Founder,0
Covid results of Amarin's drug this Sun Aug 29th at ESC Congress,0
$CAN after $SPRT and $AMC now it’s $CAN turn to make a biiiiiiiiigggg spike. Let get ready next week is $CAN and $NCTY turn to fly🤗hedge fund from $BTC.X community dumping all money on $CAN #Reddit and #Twitter army red alert.,0
I found a 500m company run by a Buffett wannabe: Biglari Holdings and Sardar Biglari,0
To the other retard who thinks he is an idiot for selling $SPRT early - I am the biggest idiot.,0
Describe a stock/company badly,0
SOS,0
Lazy kids,0
Newbie trader,0
Jerome Powell Speaking about Inflation at Jackson Hole 2021,0
What's your thought for Monday?,0
With a little more volume. This stock will be the next sprt stock. If we could get 100-130million volume on Monday. The uncovered TRCH shares will start being covered. MMAT 🚀🚀🚀🥳,0
"My secondary portfolio with ""risky"" stocks. Opinion?",0
Learning Options Trading?,0
A fast growing active stock server dedicated to making you financially free!,0
Xela now,0
"For anyone who's interested in stock scanner free, here's a video I made about one of the best of there. Hope you like it.",0
ASTA,0
The most pessimistic stocks covered in the news over a mid week period (8/22-8/25),0
REIT Top Movers of the Week - Aug 23-27 - USA &amp; Canada,0
The Most Optimistic Stocks covered in the news over a mid week period (8/22-8/25),0
The most mentioned stocks in the news the over a three day period (8/22-8/25),0
Heat map for today,0
PSFE next SPRT Heavily Shorted Large FTDs Cycles coming up Large OI Whales! DD TA,0
S&amp;P EOD Visual Summary: Aug 27,0
"Here is a Market Recap for today Friday, August 27, 2021",0
41- 42,0
Ticker $Ncty doesn’t make sense and looks undervalued.,0
Let’s move INO to moon !,0
"$MRNA is consolidating after hitting my $400 PT. I would love to see it bounce off Fibo at $349. If it does not, I see it dropping to $308 for a good looking buy point.",0
Can someone explain why the SEC has $LITT 20-F form instead of $NEGG on Newegg's page?,0
Graham's Net Net Strategy - Back 2 Basics.,0
Support.com a decoy??🤔,0
Back 2 Basics: Graham's Net-net Strategy,0
option question,0
Caesars Entertainment Is Striving To Benefit From Online Gambling Growth,0
Vermillion Energy,0
I got $100 for an option play untill October 1st any suggestions,0
Major players for a potential 1.000% on the long run,0
Wow... 450% in 5 days!!,0
"My dramatic trading history. The spikes are IBIO and CODX in Feb 2020, Dogecoin in May 2021 and AMC in June. The dips are withdrawing profit, then ultimately transferring to another brokerage. Holding AMC and GME currently, expecting my future graph to dwarf these spikes!!",0
why are reits so populair?,0
Question about daily returns.,0
Question for Freetrade investors - which stocks do you invest in and why?,0
Can i get feedback on my Roth IRA picks?,0
U.S Health officials move up covid-19 booster shots timeline by 5 months instead of 8,0
Is Joby Aviations Stock Heading to the Skies?,0
SEC: Where words don’t come true,0
SPWR to the moon!!! Good growth stock with less P/E Ratio and High Potential.,0
SPRT to the moon,0
"Back at it again, Ken Adams shows off the new CardanoTrees NFTs! The live weather updates to the NFTs is such a bad ass touch!",0
Rate my port.,0
How to spot good shorted stocks,0
Wk 23 1k portfolio,0
I'm 22 and have been tinkering with stocks for 2 weeks now. How does this first time portfolio look?,0
A HUGE 🏆 OTC UNDER A CENT HEADED TO $3.50 TARGET PRICE BY TOP BROKERS IS PHIL $PHIL BUY U WILL BE A MULTI MILLIONAIRE,0
Took a lot of advice from you guys in my last post!,0
What meme stock next? Where’s the meme army?,0
The 16 Year Old Baby Investor who barely has capital to invest so he buys fractional shares Portfolio.,0
ASKING QUESTION,0
"Rivan is seeking a 70+ Billion valuation in an IPO, which would make it the largest IPO in history.",0
Website,0
Top 5 tools I use to analyze and invest in Stocks Market | How To Become an Investor For Beginners,0
VZ - in the Bargain Basement,0
Warren Buffett's Legendary Interview,0
"If you put $3,000 into this stock back in 2019, then you would’ve hat $63,000!",0
"I like to call this method, square and a small square",0
Brokers that let you trade multiple accounts simultaneously,0
Short Term High Yield Bond ETFs,0
Rebel Daughter Adult Game,0
Toyota “self-driving” vehicles are as visually impaired as the pedestrians they run over,0
Powell speaks today and says he will start tapering and says the market running hot 🥵 inflation is above what we like and the market moves up ⬆️. 6 months prior Powell says the market great everything fine we’re not adjusting or even speaking about inflation till 2023 market drops ⬇️ 3% wtf?,0
How come FRXB and BODY separate stocks when I bought FRXB first?,0
rookie here,0
Why doesn’t FXAIX get updated every day? How does this index fund work? I have checked fidelity and this index fund hasn’t been updated. Can someone explain?,0
Fed Chair Powell delivers his Jackson Hole economic speech Live.,0
$PHUN #Phunware Launches #PhunCoin,0
$NAOV has consolidated after it's August 17th run up and could be poised for another move.,0
Charles Payne briefly mentioned BLNK Charging yesterday. I did some digging. The company doubles revenue quarter over quarter,0
Support.com (SPRT) squeezes; up 150% in pre-market,0
SHTF,0
NFT,0
Southwest Airlines cuts flight to fix what they call “operational issues”,0
Altria Cranks Up Dividend,0
"Morning Update for Friday, 08/27/21",0
Patrioticbets end of the week update! Stocks you should be looking at today!,0
4-5 transfer my ass,0
GUCCICAKE? your passive income token :),0
I must be the stupidest mofo on the planet,0
Well things are getting interesting now.,0
"Can we stop with ""Rate my portfolio"" posts?",0
Sfet -this is definitely the next stock to do 50%,0
SGH and VOLT,0
SGH SMART GLOBAL HOLDINGS INC,0
Rate my portfolio,0
Problems with trading...,0
"#repost @HenleBrookFinancial@downloader_ __ @HenleBrookFinancial. I want for my investor is for them to keep winning. Dm me right now, if you want to join the winning team. Sending profits to clients right now. You can Dm me if you want to start up and start making good profits.@HenleBrookFinancial",0
ஆஸ்ட்ரோ,0
Who’s interested in defence stocks?,0
Building a defence stocks trade idea… based around the geopolitical tensions including Afghanistan,0
infrastructure bill and ev charging stocks,0
"Close to perfection, but 422 is 420 too",0
What are the fundamental differences in stock and crypto market?,0
Fundamental differences in crypto and stock market?,0
$PRPO (PRECIPIO) Broken out of wedge. Inverted Hammer means it's ready for take-off. AON Partnership announced today. So bullish!,0
"How many stocks do you keep in your watchlist at any given time? Do you like a lot or just a few, and how do you manage your list as far as when to add or remove. Also anything you would like to add regarding this question.",0
Ant’s Fund Sales Platform Sees First-Half Profit Soar 495%,0
WTW to acquire Leaderim to strengthen presence in Israel,0
Share ஆஸ்ட்ரோ,0
Overjet Raises $27 Million in Series A Financing to Accelerate Adoption of AI-Driven Dentistry,0
On The Joe Rogan Experience Amarin's drug Vascepa talked about,0
Titan Traders discord #1 in finance,0
DealerPolicy raises $110 million,0
What does prices to cover the losses mean?,0
Switched from RH to TD Ameritrade!,0
Capital IQ Stock Screener,0
Like a Dream Come True —&gt; The tZERO ATS blockchain-based trading platform enables “price discovery” based upon Pure Free Market Forces! ... DD Research from HawkEye1000x,0
Capital IQ Screener,0
Capital IQ - P/E Ratio,0
Rate my portfolio? (Ignore BTZI pls),0
What are some good picks assuming China invades Taiwan.,0
"Newish investor, need advice on portfolio",0
Coinbase ( COIN ) Will It Bounce? - 8-26-21,0
TQQQ vs BTC some thoughts and questions,0
Rate My Portfolio- dividend growth focused,0
$RTON /Endo Brands,0
Elon Musk Wants to Sell Texans Electricity; Tesla has filed to become a Texas power retailer in a move that could shake up an already fast-changing market.,0
Judge my long term portfolio,0
EXCLUSIVE Microsoft warns thousands of cloud customers of exposed databases,0
Enjoy my 8/27/2021 Watchlist - thanks for the constant support!,0
Warren Buffett: How I Would Invest if I wasn't a Billionaire,0
AMC stock is down but not out 🚀,0
What? No map today?,0
"#StockAlert - FSD Pharma signs definitive agreement to acquire 100% of Lucid Psycheceuticals Inc. Lucid Psycheceuticals, a Canadian-based specialty psychedelic pharmaceutical company, is developing novel molecules and combinations with the goal of addressing Total Brain Health.",0
Anyone here was around during the 2008 crash?,0
KKR announces new net lease investment platform - CRE Herald,0
Anybody was around during the 2008 crash?,0
Top 3 Corporate Finance Programs,0
Lord and savior to all weekly options bag holders. Tomorrow the lord shall saveth thy tendies.,0
"How real assets stack up to stocks, bonds when inflation is high",0
Rate my profile,0
"Here is a Market Recap for today Thursday, August 26, 2021",0
Thanks for the sell off! J Powell daddy will make my weeklies I bought at the days low print. Love tapper tantrum FUD. It’s like clockwork.,0
Growth Focused Portfolio,0
Bullish Alibaba research.,0
RKLB,0
A question about market movement rationalization,0
"#afterhours 08/26 $NNA - Navios Maritime Partners L.P. Announces a Merger with Navios Maritime Acquisition, $BILL - Bill.com Reports Fourth Quarter and Fiscal Year 2021 Financial Results, $GNLN - KushCo Holdings Receives Stockholder Approval to Merge with Greenlane",0
Cell and gene therapy firms see over $13.6B so far in 2021,0
$IPSI - OTC about to pump,0
"JOIN new Superstonk subreddit for all STOCKS: r/SuperWallStreet. Best posts and comments will receive awards from our moderators. We call it REDDIT, because we are free to say what we think.",0
What app is good for investing long term?,0
Help a brother out and maybe you too!,0
Da fuq peloton,0
Question about closing Multi Leg contracts,0
Just started investing more but any tips and dividend stocks? Can anyone give me some great ones. I got about 10 different ones right now but would love perspective from other investors!,0
Leaps and JPow's Meeting,0
Curse these manipulators!!!,0
"DD: TKAT and OCG are scams, again.",0
"Virtue signaling overload of food companies and restaurants. At what point do all their meaningless labels get ignored by consumers and investors? How does virtue signaling increase revenue, profitability, or stock price?",0
Blockchain for Financial Services - Top 3 Training Picks,0
Let’s have a moment of silence,0
DYNAVAX stock prediction .....,0
This Stock is 128% undervalue. It's a good opportunity to buy it now?,0
Hyper Growth,0
A HUGE 🏆 OTC UNDER A CENT HEADED TO $3.50 TARGET PRICE BY TOP BROKERS ON WALL STREET IS PHIL $PHIL BUY U WILL BE A MULTI MILLIONAIRE,0
PSTV,0
Brokerage going bust,0
Bargain Basement Buy -- VZ,0
Midday recap on Stocks making the biggest moves,0
"China's regulations, the new 5 year plan, and what they are realy trying to accomplish $BABA",0
"Sell today, buy the dip tomorrow",0
"Hey investing squad, in this video I cover why copying the investments of the richest people on the planet (Elon Musk, Warren Buffett, Bill Gates) may yield mediocre results and what we should focus on instead as investors",0
Why not buy in to back berry ?,0
BUY $ZKIN now. It is just the beginning of the huge moves around their own NFT platform!,0
Is there a way to replicate the SPX at 5X?,0
Is there a way to replicate the SPX at 5x?,0
I know I know I shouldn’t be on cash app but actually I should cause it’s where I first started I also have public and Coinbase and a trust wallet but my question is where should I move a few of these tendies after the 🚀 take off?,0
Junior Mining Could be a Big Opportunity,0
Finally after a lot of work I’ve made it back,0
$CGX Cineplex,0
TSMC raises chip prices by as much as 20% amid high demand,0
We hear it all the time that one can only make money using Buffett's approach is if they have large sums of cash. Warren Buffett outlines differences and similarities between his and Ben Graham's approach on investing.,0
"Pentagon confirms 'number of' U.S., civilian casualties in Kabul explosion",0
IGNT this company is a hot 🔥,0
Tier list of stocks by their average news sentiment expressed during the month of August:,0
Gourmet Provisions International Corp. (GMPR) Announces Pizza Fusion Gluten-Free Frozen Pizzas Now Available At 50 Grocery Stores,0
Is Coupang really worth $31 a share?,0
Is $CPNG Coupang really worth $31 a share?,0
"$RGGI News: Resgreen Group Announces Hiring of MediaTek, LLC for Investor Relations Communications.",0
Which AQN?,0
MIND Technology Announces Fiscal 2022 Second Quarter Earnings Release And Conference Call Schedule,0
Have been skimming crypto earnings and moving them to stocks,0
Pentagon confirms explosion outside Kabul airport.,0
a 20 year old’s portfolio- holding more of both in schwab rocket 🚀 🦍 I like bofa deez stonk 🍌 🍌,0
SEC Alleges Ponzi Scheme Posed as Private-Equity Fund John J. Woods and companies he controlled allegedly collected more than $110 million from investors.,0
“Next Robinhood” CEO hatches plan to give away stock to early users,0
"My stocks picks of the day: Paypal, Lennar and RH. What do you think?",0
Dividend Reinvestment in Fidelity?,0
Hong Kong-listed gaming giant Razer is considering a secondary listing in the U.S.,0
Possible Attack at Kabul airport before evacuations are complete,0
Forbes is set on going public!,0
WHY people buy SQ when PYPL Is so much better ..,0
"Google, Microsoft plan to spend billions on cybersecurity after meeting with President Biden",0
"Jobless claims total 353,000 vs. 350,000 estimate; Q2",0
"Started a bit over 1 year ago, mostly swingtrading with holds between days and months/years",0
Taliban Could have plans to Attack Kabul airport before evacuations are complete,0
lettts gooo people what are you waiting for 💪😁,0
Thoughts on hotel stock,0
TikTok policy change hurt crypto creators,0
"Do you know the minimum margin for equity intraday trades? Watch an exclusive interview on ""Intraday Margin Rules"" Start trading and we will help you . 🌐 - https://swastika.co.in/vplanding 📞 - 87706-01437, 75566-88024",0
"TD Bank reports $3.55B Q3 profit, up from $2.25B a year ago, beats expectations",0
Mirum Pharmaceuticals,0
