title,stocks
Buying the dip help,1
Does anyone here believe in blink’s strategy?,1
Revolutionary Access to Intangible Asset Data of Fortune 500 companies,1
"Top Gaming Stock Under $5, China",1
Best sources for stock specific news?,1
Is it “too late” to invest in Tesla and Microsoft?,1
How come different securities of the same company have different financials?,1
The long case for Sony Corporation (6758 JP),1
I have a question about exercising an options call.,1
What is a good revenue growth rate yoy?,1
"Investment Advice. Stocks, ETFs or Real Estate? Plan on retiring in 1-2 years at 26.",1
Wanting to get into stocks,1
NOKIA TO THE MOON- MEME STOCK LORD,1
NOKIA TO THE MOON- Your Great Meme Stock Lord,1
Transferring from RH to fidelity,1
$PCG a value trap or undervalued?,1
CEI Camber Energy Inc forecast,1
Nokiaaaa tooooo theeeee MOOOOOONNNNNNNNNNN - Meme stock Lord,1
Trying to understand a 10-Q and valuation,1
If you had to put all your money in one stock for the next trading week what would it be and why?,1
China mobile &gt; CHLKF,1
Probably a dumb question but what if i trade a stock thats been moving up .005 and down .005 multiple times,1
"Serious question: made a successful algorithm for trading, but only have a few thousand in net worth",1
New to stocks need advice,1
CRWD earnings. A few questions,1
How are employee stock options for private companies valued if they haven't raised capital in a decade?,1
Stock Market Window Dressing The Art Of Looking Smart.,1
Stock app research questions,1
Stock app research,1
Assessment of DUOL,1
Online trading query- US stocks (international citizen),1
CRWD earnings priced in,1
Never really been into OTC trading but I believe TGGI has major potential,1
What causes a stock to have different market caps across different sites?,1
Just need some quick help with stocks,1
OMQS to NASDAQ,1
Why Moderna's 2x Antibody Titer News Is Better For Pfizer,1
What are some picks for stocks under 150 billion market cap for next couple of years,1
TAAS Insight,1
What happened to $AAPL and the NASDAQ at 3:50pm today?,1
Rockley Photonics $RKLY,1
What is everyones favorite penny stock?,1
New(ish) Trader,1
Quick and dirty analysis of monthly S&amp;P 500 returns since 1990,1
Thoughts on my portfolio? (18 year old),1
Question regarding Covered Calls,1
Should I switch to a ETF?,1
Is it possible for the price of a stock to go down if the company releases a good earning's report?,1
"Lightspeed Commerce, a secular compounder for years to come",1
Oil stocks impacted by hurricane Ida,1
Does anyone know the history of ONTRK?,1
Crowdstrike earnings,1
Anyone know any good stocks to buy?,1
Hard to borrow securities Q&amp;A,1
"With an upcoming merger, are shorts required to cover or will they convert with the rest of shares and options?",1
Are there hidden costs to this strategy? (Frequent fractional buying),1
SKLZ (Skillz Inc.) Jumps on Rumour of Buyout,1
$sys Sysco? I got a call for November…… might be the first one to actually be worth something.🤣.,1
PGEN?? Good or bad?,1
Question about the CN/KCS voting trust announcement,1
ATOS - small upward trend?,1
Adidas or Nike?,1
"PsychoMarket Recap - Tuesday, August 31, 2021",1
"Options… options, options…",1
A winning month just finished. Prepare for a pullback in overpriced stocks!,1
Cross post! Stock has KIID!,1
Does anyone know any 3D house printing companies with a stock?,1
Stocks have KIID? Yes!,1
"BOOM, I mean BEEM to the moon!",1
How to trade American stock as a Chinese citizen?,1
Where or from whom can one study in Germany?,1
A little DD on $NOVN,1
A Quick Question,1
Xela 📈📈📈don’t miss,1
"Tools or apps to track lots of trades, reading articles, misc data etc.",1
Upcoming stocks with potential to be added to major ETFs?,1
Dividend Stock Advice,1
Tesla- stock newbie,1
$ANY - Green cryipto mining company,1
Nio and European premium car brand Lotus form EV partnership,1
FNKO nfts Sell Out Again,1
What is bag holding? Is it bad to hold almost worthless stock long-term?,1
elys gaming is on the move,1
elys gaming on fire,1
Investors Be Like…,1
Reside outside the US so 30% of dividend payments are withheld by my broker (IBKR) - should I avoid dividend paying stocks?,1
Why does Microsoft have a higher P/E ratio that Google and Apple? Is Microsoft expected to grow more than the other two?,1
Best site to see analyst price targets?,1
Are the premiums you pay the most you can lose if you buy call options?,1
Been a while since we talked about IAG,1
"Bag holding: what is it, and why does everyone seem to treat it badly?",1
Dc Server with free Alerts and free education on TA,1
Question about options,1
Should I Open a Second Brokerage Account?,1
https://www.globenewswire.com/news-release/2021/08/31/2289164/18367/en/ComEd-and-AMSC-Announce-Successful-Integration-of-Resilient-Electric-,1
Hidden Gems Discussion Attempt #2,1
DHT— deep value,1
Are Semiconductor stocks going to be worth it in the long term?,1
RGC stock is on the rise !!!!!,1
help with new investing?,1
401K/Retirement Account $AMC YOLO,1
pacaso start up,1
Is TLRY going anywhere?,1
BABA is the most bought stock amongst the biggest investors in America in the the last quarter.,1
Paysafe $PSFE a worthy investment?,1
RIVIAN IPO Share valuation,1
Why is Zoom share price falling so much?,1
ZOOM (ZM) - Buy?,1
Stock Advise,1
How does selling a put against a stock that pays a dividend affect pricing of that put?,1
What are your thoughts on RDHL?,1
New idea: XAIR,1
"Julian Emanuel warns market in 1999 dot com era bubble, predicts 10-20% market correction - source CNBC.",1
$ASTS 🚀🚀🚀 #WallStreetBets,1
Best site for a paper trading competition?,1
Best free site to run a paper trading competition?,1
How many stocks are worth over $100 a share?,1
The CVM recovery play,1
Check out LGIQ,1
What sticks to invest,1
U.S. Consumer Confidence Falls to Six-Month Low on Delta Variant,1
Is this is a good strategy for managing my capital gains?,1
buying and selling,1
New idea: XAIR. Strong moves up before FDA news; hedgies and insiders are buying.,1
$BBIG Turning To a 💎,1
Advice please,1
What if the market doesn't correct itself in September?,1
Thoughts on VIAC,1
Companies that would benefit from Epic Games Lawsuit against Apple?,1
Cashapp investing long-term 20+ years?,1
Judge in Nokia and Apple lawsuit owned Apple stock during proceedings,1
Daimler AG Possibly Selling Off Detroit Diesel In Attempts To Leave Internal Combustion Engines In The Past,1
Am I the only one who thinks TEAM (Atlassian) is crazy overvalued?,1
I need some help with Trading View.,1
"Can someone explain to me how options, calls, puts and other things like that work?",1
Would breaking up AMZN into a separate AWS / retail operation / whatever else be better for the stock price?,1
"Making a stock app, have a few questions",1
My wife wants stocks for her birthday present,1
Green shoe and lifestyle brand Allbirds files for IPO with plans to list on Nasdaq as 'BIRD',1
Cardano thoughts?,1
Dividend stocks to park in,1
"Morning Update for Tuesday, 08/31/21",1
Federal Reserve Meetings Question.,1
I think I fucked up... new trader here,1
NORWEGIAN AIRLINES BOOM,1
First time invester... have 1000 to start off with where should I put it?,1
China Threatens to Ban E-Commerce Companies That Flout IP Laws,1
China stiffens regulatory penalty on e-commerce companies,1
How is it possible to invest in Turkish companies from Denmark?,1
Monthly Investing Youtube Channel,1
Tapering (bad time to invest?),1
Best Companies for Long Term investing that pay Dividends?,1
Cathie Wood thinks Facebook's payment platform and currency will be as successful as Facebook Messenger was... (i.e. Not Very),1
"r/Stocks Daily Thread on Meme Stocks Tuesday - Aug 31, 2021",1
"Zoom Video, AMC, CrowdStrike- What to Watch When the Stock Market Opens Today",1
Question regarding BHP Group,1
Stocks that you consider hidden gems,1
What would you do about such an election?,1
"r/Stocks Daily Discussion &amp; Technicals Tuesday - Aug 31, 2021",1
Full Re Yolo $PLTR🚀,1
Is a stock being added into an ETF good?,1
DIGITAL TURBINE (APPS) will join S&amp;P MIDCAP 400 ON SEPTEMBER 7,1
"FT, derivatives article",1
Acasti Pharma,1
What actively managed funds &amp; portfolios do you follow?,1
"how are trades recorded, is there some type of 'trade id'?",1
What should I do?,1
How to hedge against FX risk,1
how are trades logged/recorded? is there a 'trade id'?,1
How are trades recorded/logged?,1
how are trades logged/recorded? like how hashes are for crypto,1
"Expense ratios, What exactly and Why are they bad?",1
16 years - interested in stocks,1
Would it make sense to invest money I don’t need for a timeframe of 2-5 years?,1
Is CAGR higher when you DCA vs lump sum?,1
What are your picks for the next 10X growth stocks?,1
Transferred stock from Morgan Stanley to Merrill Lynch. Need selling help.,1
I need help understanding why a millionaire would buy…,1
What kind of shares should I buy?,1
how do you find 100 baggers? What do you look into?,1
Achievement Unlocked 🏆,1
Do investment banks purposefully predict lower earnings numbers to capitalize on positive post-ER price action?,1
Looking for advice,1
Where/how to trade $ADA or $SHIB?,1
Hua Xia Bank China suspends personal foreign exchange trading business from December 1st,1
Investing tips at 15,1
IBM - Buy now or wait for company spin-off?,1
My Apple satelite play DD,1
Can I transfer current stocks into an IRA instead of cash?,1
Stock Sale Question,1
When do you cut your losses? Would you let losses go into your principle?,1
Website for what others have invested?,1
What is the lure for draftkings?,1
Need help for clarification of contradicting EPS data,1
Selling stocks reduces the gains shown?,1
Question about PLTR eps,1
Maximize capital gain or minimize it,1
ISPC finally a real deal,1
NEW DISCORD CHANNEL,1
Question about PFOF,1
"Is AQST a buy? Low float, new product launch",1
For the future,1
Tips for an ABSOLUTE beginner?,1
Why has NFLX stock shot up recently?,1
Tesla Price Drop,1
BRAX - Braxia Scientific Reports First Quarter 2022 Financial Results; Company Achieves 80% Revenue Growth,1
"Palantir is awarded a $48,500,000 firm-fixed-price definitization modification for a Data-as-a-Service Platform, by the U.S Air Force.",1
WARNING - Are we approaching DOT COM ERA levels of OVERVALUATION in the MARKETS? It may just be getting ready to BURST!,1
Investing in US stocks from the UK,1
Have you ever fallen in love with a stock? We all have heard about FOMO but how can we prevent reverse FOMO when selling stocks?,1
September is almost here.....,1
What is a good/sane way to get into trading?,1
Will someone else swoop in to acquire Five9?,1
“people who bought BABA at X price should’ve waited and will hurt on the way down” - Why I disagree.,1
"Vrpx, nasal covid-19 vaccine true ?",1
Is SPRT still a buy for tomorrow?,1
$AMRN and $PFE will be at Munich Heart Congress Sept 17th &amp; 18th,1
PayPal is thinking about starting their own trading platform,1
Any leaked stock picks? Pre-subscription,1
What is going on with [the forecasts for] $BIDU?,1
What stocks should I invest in?,1
How low can $BABA go? $0 is not impossible,1
How low can $BABA go? @drawdowndaniel says $0,1
Zoom drops 12% on lower than expected guidance,1
Would it be insider trading if I...,1
Is providing fractional shares complicated for brokerage firms?,1
"Here is a Market Recap for today Monday, August 30, 2021",1
Wouldn't shorting $BABA be a no brainer?,1
$UGRO: what is there not to like?,1
"Value investing, but not the Warren Buffett Way (still somewhat though)",1
"Would leveraging/""rebalancing"" from SPY into SPXL during a market crash increase long term performance?",1
China Commentary Calls Xi’s Crackdown a ‘Profound Revolution,1
Is a wash sale bad?,1
When to take profits,1
Amazon &amp; Google,1
Can Owning Stock be Explained?,1
upcoming BioTech plays,1
[ OPINION ] - Opinion about my portfolio (up 12.5% since June and growing like CRAZY),1
"HOOD drops after SEC's Gensler says ""Banning Payment for order flow is on the table""",1
how do executive exercise stock option way below market price?,1
Looks like $AMRN 's drug Vazkepa goes on sale on Wed!!!,1
SEC Chairman Says Banning Payment for Order Is ‘On the Table’,1
"DigiMax (CNSX: $DIGI, OTC: $DBKSF) Enters Collaboration Agreement with Singapore-Based Bitget Exchange",1
"WKHS, yay or nay??",1
SPY shares -vs- calls for medium term to long term gains over time?,1
Where in EDGAR can i download financial statements?,1
"I'm probably going to end up giving it all back, I guess.",1
Best app/website for investing!,1
IBKR Price Management Algorithm?,1
Carvana (yikes),1
What stocks were considered growth stocks around 2010-2015?,1
Waiting list for trade 212,1
Risky low priced stocks vs reliable stocks/index funds?,1
What’s happening with LTC Properties Inc (LTC)?,1
What do you consider in valuing longterm stock picks?,1
PayPal explores launch of stock-trading feature.,1
Does anybody do stocks for fun?,1
Buy entergy shares To the Moon,1
I think this is a catalyst for $RBLX,1
Does anyone know why Big Five (BGFV) is moving up?,1
Was looking for some advice on my Roth IRA,1
Up 46% since Starting Investing 2020 in VOO,1
Is there any app that gives alerts in portfolio value change?,1
SALESFORCE: GET IN BEFORE ITS TOO LATE.,1
Why is Salesforce's P/E Ratio so high?,1
PayPal is exploring a stock-trading platform for its U.S. customers,1
Thoughts on William O’Neil’s book “How to Make Money in Stocks”,1
Shorting airlines,1
Where’s a good source to go for DD?,1
Why aren't sports book stocks going up?,1
Best Investing Education Program,1
What does everyone think about TEAM?,1
Buying NFT’s,1
Learning how to use Monthly Tracker stock,1
Investment firm threatens with legal procedures when my dad refuses to sell his stocks of ICT Group,1
Question About Just Energy,1
Helmerich &amp; Payne: Undervalued Leader in Innovation,1
Why everything is going up together (sort of squeezes) ?? Something is going on,1
What suggestions would you recommend for someone starting to invest in a particular ETF?,1
Low risk 10X opportunity?,1
"Looking to buy a gaming company – Budget: $15,000 ~~ Activision Blizzard vs Electronic Arts ~~",1
"Big shorters, where the money comes from at the end?",1
What’s happening with airlines?,1
noob re-entry question RE: how long do you wait and watch before re-entry?,1
Best stock training app,1
How to learn about stocks?,1
Advice on investing,1
What business news do you use or monitor?,1
"More crackdown by the CCP on video games, minors can only play 1 hr on Fridays, weekends and holidays. SOL for Tencent and NetEase holders.",1
Stocks or Mutual Funds for &lt;6 Month Timeline,1
Weapon protection Company?,1
Tastyworks 100 share promo data point,1
Petition to Disallow Citadel Being Exempt from the 1940 Investment Company Act,1
"What is WSJ Markets trying to say, in this instance?",1
The top 10 most cashed up psychedelics companies right now: ATAI CMPS MNMD FTRP SEEL CYBN LKYSF DMTTF TRUFF BMBIF,1
$OEG DD and Hurricane Disaster Response.,1
I wanna get into ETF's but have absolutely no knowledge of Stocks and such,1
"When the fed starts the tapper, will it cause treasuries to crash??",1
Tastyworks 100 shares pomo data point,1
ABOUT BBTV GLOBAL MEDIA AND TECHNOLOGY COMPANY,1
a very important question,1
"r/Stocks Daily Thread on Meme Stocks Monday - Aug 30, 2021",1
Best Beginner's Trade Manual,1
Discord Groups that focus on Support and Resistance as a way to save time?,1
Is there a list of keywords that trigger the auto mod?,1
What do you guys think of $GRPN as a next squeeze candidate?,1
"r/Stocks Daily Discussion Monday - Aug 30, 2021",1
Scalping books and other resources,1
MUFC could see a climb this week following the signing of Ronaldo.,1
The oracle says the market is overpriced,1
How to hedge against falling USD,1
How to hedge against falling usd,1
FREE STOCK! BUXZero up to 100$,1
The best PLTR bear case I found,1
lets hype some stock?,1
Atari Stock DD,1
NNDM STOCK Will it Recovers To All-Time Highs Over $100? Support and Res...,1
Anyone buy VLA yet?,1
Should I sell and buy more or hold and sell later ?,1
China Crackdowns Multiply as Xi Pushes for ‘Common Prosperity’,1
What is everyones thoughts on Piedmont Lithium?,1
What do you think about Ventripoint (TSXV: VPT)?,1
$RMR $7/share dividend early September.,1
Tattoo Chef Complete DD $TTCF,1
Calls on XAIR has been making me money for the last 2 weeks,1
Best SnP 500 ESG ETF?,1
OBE.TO Obsidian Energy info,1
What to do with 10k sitting in my brokerage account.,1
SPRT will stay on my radar this week.,1
Chinese big tech,1
What type of companies/industry do you think will be one of the biggest 20 years from now but doesn’t exist at the moment.,1
What type of companies do you think that doesn't exist yet and will be one of the biggest 20 years from now?,1
Mobileye Robotaxi in 2022,1
Stock portfolio loan question,1
"Hello everyone, is there an ETF, Mutual fund that you follow during the market day? The DOW, SP, NASDAQ hit records but not what I trade",1
Mdma for sale dm me,1
"How much has effected you investing into the stock market, both physically and mentally?",1
Is MYJ really tax-free municipal bond fund?,1
Root $20 calls 9/17,1
Solar? Bullish? What are your thoughts on the clean green future.,1
Is there a website that deals with algo trading backend?,1
Investing 10K in 10 ETF,1
New to stocks,1
Any advice for buying stocks at a young age? Thank you,1
I’ve got $600. Where should I invest it?,1
Need some expert advice,1
Inflation has been over 5% for the last 3 months. The last time this happened?,1
Any websites that deal with algorithmic trading backend?,1
How much cash do you keep in the bank?,1
Trading in personal account vs LLC,1
John Paulson reveals everything about his Big Short that made him $20 Billion during the 2008 financial crisis in this Rare interview.,1
Helmerich &amp; Payne: Undervalued Industry Leader in Innovation,1
"Tesla, diluted share count, and ARK research.",1
If your going to join robinhood might as well us my link so we can get a free stock,1
Good Mid-term stocks?,1
Submit your worst possible portfolio (and lets check them all in 6 months),1
Losing my mind here trying to find a good portfolio tracking app!,1
"A great stock HIMX, short squeeze soon",1
"It will only get harder for foreign investors to do their DD; ""China to cleanse online content that badmouths its economy.""",1
"It will only get harder to figure out how $BABA et al are really doing; ""China to cleanse online content that badmouths its economy""",1
Why $AMRN retweeted Sept Lancet issue!!!,1
VTSAX vs Higher Risk Options,1
Dollar tree.,1
VTSAX vs Higher Risk Alternatives,1
$SLQT SelectQuote stock with significant upward potential High PT of $39,1
Transferring from Stockpile to Webull,1
Thinkorswim beginner,1
Suggestions on active stock trading with new job schedule,1
Question regarding investing. If I invested $1000 into a company that has a 35% increase every three months. Would I make $350 if I sold?,1
Is there any public free list to see all the world stocks classified by % increase?,1
Question: if I invest $1000 in a stock that has a 35% increase after 3 months. Does that mean if I sold I’d make $350?,1
Newbie question: if I invest $1000 in a stock that has a 35% increase after 3 months. Does that mean if I sold I’d make $350?,1
"Of interest to $BABA holders: ""China to cleanse online content that badmouths its economy""",1
What is the lowest conviction stock you own and why?,1
any good brokers for the uk for trading on the s&amp;p 500,1
thoughts on Upwork (UPWK)?,1
How do I trade as a child,1
Evogene 900% potential,1
Anyone else invested bigly in the energy sector?,1
Which stock is better?,1
"$TAAT, a hemp based cigarette, tobacco and nicotine free alternative looking to disrupt the 814 billions dollars tobacco industry.",1
Paper Trading App That Allows You To Practice Options,1
"Why do people know it, but don't own it?",1
Are Defense Stocks even worth it anymore?,1
"When a crash/correction happens, how should one prioritize which stocks to DCA first?",1
LVCA 😮 The Joys Of Being In The Right Place At The Right Time,1
Am I about to become a billionaire or am I missing something?,1
Looking up old stocks,1
"Natural gas is about to reverse, which means the time to buy KOLD is probably next week.",1
ENDP: any reasons to stay bullish?,1
Top podcasts,1
CRM a good long term buy?,1
"AUGUST 2020 PERFORMANCE🎯🤑:PM FOR 800-1200 PIPS /MONTHLY 20-25% RETURNS,4...",1
Takeaway into $AMRN's German launch 13 days from now,1
If predicting the market is impossible then what should stock investors rely on?,1
Question about transferring brokerages with margin,1
stock market question from a dumbass,1
Paid Project Opportunity: We are Looking for People with Stock Trading Experience!,1
Looking for strategies and ideas when Fed tapering happens,1
"Did I miss something? BILL was up 30% This Friday is up 1,000% from 20s to near 300 in 18 months? Any opinions? 27 Billion dollar company?",1
ARKQ for the massive supply chain crisis going on?,1
What do you base yourself off when investing in different stocks?,1
Hemprise (HEMP),1
The Weekly DD - Skillz Inc (SKLZ - Full Stock Analysis): E-gaming for non-gamers,1
Active trading suggestions while working new job,1
"Upcoming anticipated ""4th wave""stock benefactor",1
Semiconductor stocks,1
Buying stocks after hours?,1
Why I am buying shares in PulteGroup(PHM),1
"I recently bought 10k SPRT options, best way to proceed?",1
Could rolling stock (railway) hit off in the next couple of years?,1
HKEX: Strategy of buying on open when in different timezone and without an order book,1
VOO/SPY + VT — why is this more popular than VOO/SPY + VXUS?,1
Does investing in sustainable/ESG funds/stocks really make a difference?,1
Operate stocks in 5 minutes and earn permanent passive income!,1
Stocks least affected by Covid crash last year,1
Potential Chinese market crash?,1
"How can a stock be labelled ""strong buy"" even though the 1yr price target is - %?",1
Am I screwed?,1
SPRT - target,1
Is there any world where Rivian and Lucid don't just go bankrupt,1
Is AT&amp;T a good investment due to its high dividend yield and very low volatility?,1
technical analysis,1
"In 2015, Elon Musk made an ""insane"" prediction that Tesla will reach a $700 Bn market cap by 2025 - Tesla beat this estimate by 4 years",1
The best bear thesis of PLTR I found,1
What are good stock plays Hurricane Ida,1
How does 5% inflation change your thinking?,1
May someone answer this (thanks.),1
I can use some assistance!,1
"Hims &amp; Hers Health, Inc $HIMS FTD Table",1
"Why did Cathy Wood and Peter Thiel (founder Palantir, eBay ...) invest so much into CMMB (Chemomab)?",1
Good Stockss,1
Hurricane Ida strong,1
I am looking for some information or guidance on SLI,1
Thoughts on SLI? Help sought.,1
How much are you setting aside?,1
Is this a millennial market? Do you also notice extreme volatility never seen before even in the 90s? Has it shaped your trades? How?,1
Critique my strategy to investing,1
"What happens if BABA, JD, or TCEHY get delisted?",1
Is ASML a huge investment opportunity?,1
The one true stock that matters NOW,1
First time investor,1
Any opinions on ENDP? What’s driving it down? Vaso? Opioid? Will it recover next week?,1
Investing for student debt repayment,1
Stocks assistance,1
You get seven thousand dollars,1
Any thoughts on DVAX,1
URGENT❗️need some insight,1
CARA going $30-35 soon! Screaming buy!,1
Searching for historical data,1
Best Investment Type Post-Roth-Max for College Students?,1
Best trading platform for beginner investor,1
AFRM aftermarket surge following news of deal with AMZN,1
"Why buy an index, when I can buy a weighted index?",1
How does one find where good shorted stocks are,1
Buying stocks,1
$15 Call Option for ATER,1
DVAX is the next 5 bagger covid play???,1
Lovely inu is here,1
Crsr moon pls I’m poor,1
"If given $10k virtual money, can you 10X it with binary options trading?",1
Best website/app to invest in stocks,1
Is it worth looking at other long term stocks if I’m already heavily invested in long term ETFs?,1
I started a finance news aggregate site called Macrohint.com,1
Too soon to invest in hydroponic agriculture?,1
Historically do they value correctly the initial value when companies go IPO?,1
Invest in GOOGL and GOOG or pick one of the two?,1
Is there a way to buy GOOG without dropping 3k?,1
Oncternal Therapeutics the next BO in the Biotech Sector.,1
Is Fresh Del Monte Produce (FDP) a buy right now?,1
New work schedule while trading,1
Thoughts on JOBY and ORGN?,1
What are some examples of companies with a wide moat?,1
Site with intrinsic value for stocks,1
401K target date fund question,1
The AMC and GameStop Situation Explained by Jackson Hunter,1
Are tech stocks overvalued at the moment?,1
Where 2 park surprise $50k for a few years?,1
PFE 😡😡😡😡😡 butthole stock.,1
MMP - The Inflationary Bet of Congress?,1
Chancing volatility,1
Do you own any stocks as a why get mad at what they do might as well own them. Or despite them having a major scandal/negative coverage?,1
Do you own any stocks as why get mad at what they do might as well own them. Or despite having a major scandal/negative coverage?,1
Help/Explanation Needed - How were they able to purchase below the market price?,1
VMW drop last week…,1
Two part question about paying for trading insights,1
What stocks do you own as a might as well make money off the misfortune of others or despite their negative coverage?,1
Coffee stocks,1
Stock trading,1
Automod block post for even using the term cr*pto is ridiculous.,1
"If you had to change one thing about the way you’ve invested in the past year, what would it be?",1
I've decided I want to get into investing,1
$AAPL 210K 9/17 OPEN INTEREST CALL OPTIONS,1
TastyWorks Platform set up,1
