title,stocks
"Before A PE .S, before Cellphones, Before you , there was the original ANTI MARKET MAKER",1
"Before APES, before Cellphones, Before you , there was the original ANTI MARKET MAKER",1
"Will someone explain Cigna's ""accelerated stock buyback"" to a Cigna employee?",1
Thoughts on vaccine stocks??????,1
What do you think it will take to get amzn moving?,1
Trying to create a stock trading community,1
Anyone play with these direxion bull ETF’s?,1
QQQm with tqqq long term,1
"Twitter, or stocktwit accounts.",1
Brokers in Eu,1
One (or two) stock(s) to put 25k into?,1
Whats up with all the meme stocks exploding today?,1
How high will AMC soar?,1
New to investing!,1
Has anyone looked into Builders First Source (BLDR)?,1
"100% equities, no cash",1
"If you could buy LEAPS for 2023 on a few stocks right now, which companies would you choose?",1
Why do the so-called meme stocks always rally together?,1
With the new infrastructure deal coming into play what do you like?,1
GME - I smell Round 3,1
got a stock reddit folks can take ahold of with low share float,1
Chinese stocks,1
Your number one rule for investing,1
Mohawk Industries DD,1
10 Reasons to Buy November $AMZN Calls Ahead of Earnings - A YOLO DD From the Chess Guy (With Proof),1
Paying taxes on gains,1
BIO (Bio Rad) . 421% return last 5 years?,1
Walletinvestor.com,1
Buying Shares on Margin,1
Do you recommend subscribing to Fintel?,1
"Nasdaq composite to a record high and past 15,000 for the first time, S&amp;P 500 to 50th all-time high close this year.",1
Shorts in a reverse split,1
Technical Thesis For a Strong Dollar,1
Dividend investing!,1
If I sell short term capital loss will that lesses a long term capital gain tax due?,1
Jacked to the teats,1
DD: $LVVV - The ZIP CODE Changer,1
Which stock from the S&amp;P 500 would you want to do a full valuation report on for a whole semester?,1
"JETS, CCL, NCLH",1
CCL (Buy signal?),1
CCL at 50 and 200 day moving average. If CCL can break above we will see a 20% move higher until end of year,1
Coty or Revlon?,1
I went deep on a sports betting stock which filed for IPO - SRAD DD,1
Any Tips on how to get better at Investing?,1
I went deep on a sports betting stock which filed for IPO a week ago - SRAD DD,1
What's this feeling called?,1
IMCC has new strain!,1
Should I Invest in Gold now?,1
I went deep on a sports betting stock which just filed for IPO - SRAD DD,1
Business Brokerage for Stock and Option Trading,1
"Here is a Market Recap for today Tuesday, August 24, 2021",1
Short-selling Volkswagen - what broker to use?,1
WSB?!? I need my resources.,1
Creating an LLC for trading,1
What do you think about XOS Stock?,1
"With all the talk about $BABA and it trending on reddit, what did you do?",1
Thoughts on PFE now to buy?,1
HMLP coming back from a dramatic low.,1
MedMen - tilray,1
BioNtech A2PSR2 on the rise,1
HOW DOES ENRICH WORK WITH NEW CLIENTS?,0
Wash sale,0
Arch Capital Group acquires Westpac Lenders Mortgage Insurance,0
Revolutionary Access to Intangible Asset Data of Fortune 500 companies,0
$PLTK... ANY THOUGHTS?,0
"Is Zoom's run over? Zoom Stocked just crashed, is it a buy or bust💣?",0
Alma Raises $50M in Series C Funding to Help Therapists Meet Rising Demand for In-Network Mental Health Care,0
Open raises $31 million,0
Amazon Stock Forecast,0
So boring,0
CEI - Camber Energy Inc Forecasting,0
CEI - Camber Energy Inc forecasting,0
sectoral growth,0
Japan finds another Moderna vial suspected to contain foreign substance,0
16 Money Rules these Millionaires Swear By,0
Corsair,0
CFTC Staff Provides Temporary No Action Relief from Certain Financial Reporting Requirements to Bank Swap Dealers,0
Stock Market Window Dressing The Art Of Looking Smart.,0
Final reminder for Euro Bank Lurkers here: Check your credit swaps / basket swaps. A disturbing price/volume correlation has been discovered between GME and DELISTED stocks such as Sears and Blockbuster.,0
Stock Market Window Dressing The Art Of Looking Smart,0
"I think every retail investor should call there brokerage, and check if they can lend your share without your knowledge",0
Free $10 in BTC,0
10 Popular REITs on alreits.com,0
Thoughts on WKHS?? It seems it has big potential,0
How to make money from facebook groups,0
First Investments,0
Why AHT is undervalued,0
Sugarmade Signs Definitive Agreement to Acquire California Cannabis Licenses to Provide for the Opening of Three New Vertically Integrated Nug Avenue Locations,0
Where do I begin? Did I lose before I started?,0
Wall Street Journal: $TELL A Fledgling Natural-Gas Exporter Has Become a Meme Stock,0
LSPD. I'm fairly new to investing and I bought this stock and I just wanted to know your thoughts on it.,0
"Will a very good August lead to a very good September? Josh Brown says FAANGs plus add NVIDIA make up about 21% of the S&amp;P 500, as long as those stocks due well, doesn't see a downside to the market.",0
$BBIG,0
Bought into SNDL at .75 sold it at .78 so i was like cool a $20 gain. Decided to buy into BBIG when it dipped down about a hour and half later boom!,0
"Wall Street Sees Nothing but Good News, Even When It’s Bad. With expectations that interest rates will stay down and government spending will stay up, the stock market has learned to live with the pandemic, even as cases increase.",0
Crazy valuation for a company with big losses which doesn't even know if or when it will become profitable,0
$RHE$ to the moonnnn!!!🚀🚀🚀,0
Heat map for 31AUG2021,0
ISEE,0
I need a investor who can invest in our stock exchange online site,0
Need investor,0
What are your thoughts on SOFI?,0
$WKHS,0
Thoughts on SOFI?,0
"With an upcoming merger, are shorts required to cover or will they convert with the rest of shares and options?",0
"#afterhours #watchlist 08/31 $UNAM - no news, $PLAN - earnings released, $IHT - no news, $INM - no news",0
$BBigg to the moon!,0
"Social Security trust funds now projected to run out of money sooner than expected due to Covid, Treasury says",0
"PsychoMarket Recap - Tuesday, August 31, 2021",0
Fundamentals of Machine Learning in Finance,0
Prepare to sell overpriced stock in September!,0
Does anyone know of 3D house printing company that has a stock?,0
AI analyzes Top Cyber Security stock - $ATEN,0
EARN 10% COMMISSION ON BINANCE,0
IBM’s First CPU With On-chip AI Acceleration Detects Fraud at Lightning Speeds,0
Thoughts?,0
How To Invest In Crypto!,0
Govx $$$$$$. Dimond hands 💎💎🖐🖐🖐 This is low cap stock —- covid mrnav2 !!! X100,0
Which pension fund?,0
DreamCatchers Financial Advisory Services,0
LFMD next short squeeze?,0
Is Gensource Potash's (GSP.V) solution mining process the future of potash development in Saskatchewan??,0
"Ex-Wells Fargo VP Fights SEC on Fake Accounts — With Silence. Carrie Tolstedt, who was a senior vice president before she left the bank in 2016, cited her right under the Fifth Amendment not to be a witness against herself more than 100 times in a response filed Friday to the agency’s complaint.",0
A Quick Question,0
BTS (방탄소년단) 'Permission to Dance' Official MV,0
Be me - Invest in TGT calls - profit for months - Get cocky - Lose all your money on TGT,0
starter app,0
Blackstone funds complete acquisition of QTS Realty Trust for $10bn - CRE Herald,0
My Biggest Secret to Investing - Seth Klarman,0
Best way to invest 1 million in cash?,0
ELYS Gaming,0
Investors Be Like…,0
Brokerages,0
Skillz is rocketing today 🚀🚀,0
Best Brooks Running Shoes - Nike Shoes - Running Shoes - Review,0
Are the premiums you pay the most you can lose if you buy call options?,0
Anyone who thinks a crash is coming needs to chill out. Covid made the economy unpredictable. No economist can reasonably forecast the market for the next five years due to all the uncertainties.,0
"SEC Obtains Emergency Relief, Charges Couple Who Operated $18 Million Ponzi scheme",0
Bluelinx Holdings $BXC DD,0
DC server with free signals and education on TA,0
BUY BUY BUY,0
FINRA day trading rule changes taking into effect next month,0
Short play,0
Dc server with signals and education (free),0
Zero Sum Game,0
I’m doing well but is it just the up market? Scared to make the jump to real trading from paper.,0
Can ZOOM recover from crash?,0
ZOOM $ZM PRICE DROPPED AFTER EARNINGS WILL IT RECOVER TO $414?,0
"South Korea bans Google, Apple payment monopolies",0
Halt? What does it mean? This was yesterday morning. BBIG,0
Massive short opportunity (general market),0
Update on my forth portfolio (experiment),0
Massive short opportunity,0
LOADED UP AND READY FOR LAUNCH,0
Stock Advise?,0
Why is ZM price falling so much?,0
Stay tuned with Kryptolite,0
Investing at a young age?,0
US Teck forecast. Pitchfork and trend channel D1,0
Nikkei 225,0
GSAT: To the moon literally,0
Investors,0
#BBIG invest in law to make the volume go up so we can make some money,0
When will this thing correct????,0
What if the market doesn't correct itself in September?,0
New idea: XAIR. FDA approval expected this month,0
KSHB arbitrage opportunity - 15% in one month,0
Mos Last Summer Adult Game,0
Billionaire investor says crypto is worthless and volatile,0
Squeeeeeezee,0
"Looking to buy a gaming company – Budget: $15,000 ~~This time: Activision Blizzard vs Take two interactive ~~",0
Get Ready for the Next Crash,0
Be patient and keep it simple. Stock market isn't as complicated as some people make it seem.,0
"KSHB/GNLN arb is 15%, vote already approved",0
"I have been discussing this at length with my broker; basically if you are doing ANYTHING on margin, even if it is at 1 penny, your positions are lent out to be borrowed by all those who short stocks and borrow shares. IF YOU DONT WANT YOUR SHARES TO BE BORROWED, DONT HOLD ANY MARGIN DEBT AT ALL!!!",0
$IHT is this a good move today?,0
PharmaCyte Biotech Establishes 18-Month Shelf Life for Clinical Trial Product in Ongoing Stability Study,0
"Ever wonder how brokerages dont need to charge a commission now? Here’s a little map of the intermediaries of the stock market, and why the Big Boys pay for order flow to compete with ECN and self clearing. I’m not saying this is a bad thing is actually good for the retail traders like us",0
Here's Your Daily Market Brief For August 31st,0
Green shoe and apparel brand All-birds files for IPO,0
"Morning Update for Tuesday, 08/31/21",0
Wall Street sets a course for gains as futures stand firm,0
"We help People to get Financial freedom.. Yesterday Malamaal Call Make real profit in share market with us...🌎 - https://swastika.co.in/vplanding 📞- 87706-01437, 75566-88024",0
THE WAR IS OVER! U.S withdraws all forces from Afghanistan,0
Hold CLOV and hope for another spike 🙌🏻💎 or sell it and buy OSH 🏥?,0
GOOGL PEG ratio 0.72 on Bloomberg has to be a bug right?,0
Monthly Investing Youtube Channel,0
Amarin Reports Latest Clinical Research Evaluating VASCEPA®/VAZKEPA Presented at ESC Congress '21,0
Cathie Wood thinks Facebook's payment platform and currency will be as successful as Facebook Messenger was... (i.e. Not Very),0
"S.Korea's parliament passes bill to curb Google, Apple commission dominance",0
"#premarket #watchlist 08/31 $SONN - Sonnet Announces Successful Completion of the Discovery Phase for Its Next Preclinical, $SYTA - no news, $SPOK - Spok Holdings Confirms Receipt of Letter from Acacia Research",0
"Tencent, NetEase Dip as China Limits Minors to Three Hours’ Gaming a Week",0
Sharing of trading experience.,0
Interesting Stock Idea - SERVICENOW A1JX4P -,0
Interesting Stock in Techworld - SERVICENOW A1JX4P -,0
I started buying some long term holdings at the beginning of August. Love the tech/IT space. Anyone have recommendations/thoughts? (Don’t have a ton of cash to spend but I’m giving my self a bi-weekly budget),0
My take on Toast which is looking to IPO,0
Changes in stock price with product price ?,0
Has anyone heard of glom trades? And if so what can you tell me about it? I'm more concerned with safety of my investments.,0
Inquiry,0
"Chinese EV Daily: Li Auto Q2 Net Loss Narrowed, Seeks to Launch First Electric SUV in 2022; NIO Builds Charging Route for Qinghai-Tibetan Area",0
How are trades recorded/logged? like hashes for crypto,0
How are trades recorded/logged? like how hashes are for crypto,0
GoHealth Partners with Aunt Bertha to Address Members' Social Determinants of Health,0
"According this this famous study, DCA seems like the clear winner. How reliable is this study?",0
Digital Turbine ($APPS) is Joining the S&amp;P400,0
"$DLPN and others, all trash",0
I'm interested in investing but don't know how/where to start,0
Just how I'm seeing it #microvision #mvis #hololens2 #iaamobilty,0
Hong Kong's OneDegree Raises $28 Million in New Round of Funding,0
Hala raises $5 million,0
"Entegris, Inc. (ENTG) stock review",0
"Need help with losses, any advice helps, sorry if this isnt allowed here.",0
Share some tickers! These are my favorites adding up to $250k,0
The Market Algo Newsletter,0
How the Stock Market (Really) Works and How to Make a Killing,0
Starting,0
Zoom after hours price down about 12%,0
New discord channel,0
NEW DISCORD CHANNEL,0
AQST stock to buy? Spike soon?,0
Most optimistic tickers in this weekend's news coverage (8/28-8/29),0
Lofi-deFi listing,0
"S&amp;P 500 Information Technology is now leading the broader S&amp;P 500 YTD, which it has done each of the last seven years.",0
"Heat map today, more mixed than last week with finance being most red",0
How To Buy Bitcoin on the Stock Market - Top 10 BTC Stocks!!,0
Question on closing a credit spread.,0
The Weaknesses of our present Educational System,0
Does anyone know why my PayPal and Amazon stocks did this weird dip,0
"As Warren Buffett turns 91, the legendary investor prepares Berkshire Hathaway for a new economy. Berkshire’s exposure to technology stocks has grown to 45% of its equity portfolio.",0
Amarin will be at Munich Heart Congress Sept 17th &amp; 18th,0
What happened with that weird dip after hours?,0
PayPal is thinking about starting their own trading platform,0
Is SPRT still a buy?,0
Should we invest in TESLA after seeing how these robots dance? 🤔,0
FDA PDUFA Back Testing Results,0
Buy this STOCK!!!,0
"Here is a Market Recap for today Monday, August 30, 2021",0
Payment for Order Flow Brokerages,0
"SEC Chair Gensler says ban of payment for order is ‘on the table’ Kate Rooney joins Closing Bell with news from SEC Chair Gary Gensler, who told Barron’s that a payment for order ban could happen.",0
Palantir Expanding In IoT. Why This Matters For Genomics. Best Bear Case on Palantir?,0
Financial Modeling and Valuation Analyst Certification (FMVA) - 10% Discount [Corporate Finance Institute],0
[ OPINION ] - Review my portfolio (up 12.5% since June and growing like CRAZY),0
TOTAL Newbie in need of guidance! :D,0
I’v found an UNDERvalued Monopoly.,0
#CREG,0
Looks like AMRN 's drug Vazkepa goes on sale on Wed!!!,0
SEC Chairman Says Banning Payment for Order Is 'On the Table',0
"I'm 17, rate my diverse portfolio 😂",0
WKHS short squeeze? Yay or nay??,0
Shrinkflation is Moving in. 1.6 ounce two pack is down to 1.5 ounces. #shrinkflation,0
Nat,0
Should I invest in September?,0
"Rate my portfolio, just started investing a month ago",0
Day Trading firms in Canada,0
Keep on pushin,0
Does anybody have info on ater ? Aterian,0
Where in EDGAR can i download financial statements?,0
"rate my portfolio, just started investing this month at 20 years old as a side hobby",0
"Rocket lab, mini space x?",0
Best app/website for investing!,0
Newbie portfolio from Feb 21,0
"DigiMax (CNSX: $DIGI, OTC: $DBKSF) Enters Collaboration Agreement with Singapore-Based Bitget Exchange (LISTED AS 7TH LARGEST GLOBAL DERIVATIVES EXCHANGE BY COINMARKETCAP).",0
$QRVO Buy signal followed by Bullish harami. $201 Price Target.,0
"Let's just say Tesla, Ford, Lucid Motors, Rivian, etc, creates every single EV car they say they will. Is there even enough lithium and rare metal in the entire Earth to support this?",0
"Jet Token Inc. Jet Token is a private jet membership and booking platform for the ultra-modern age of aviation. For the first time, you will be able to use one app to book a private jet, a commercial airline ticket or both, all on the same itinerary. Small fleet of HondaJets for membership and chart",0
Focus On These Key Factors to Avoid Losing Money When Options Trading,0
1 min read - Smoking-Highlight of last Week (8/23~8/27),0
After trading 1 year with 16 years and the money from dad. Guess what stocks I bought.,0
EV truck maker Rivian targets reported $80bn IPO valuation. Would you buy?,0
Microsoft Corporation (Ticker: MSFT) - Brief Breakdown,0
S&amp;P 500’s forward price/sales ratio has climbed to a record high,0
Calls for this week,0
Defensive assets in the market ? Suggestions please,0
Profit Ascend Review: The Best CFD Trading Platform On Precious Metals,0
Couldn't figure out why Musk was talking shit about $AAPL,0
PayPal is exploring a stock-trading platform for its U.S. customers,0
PayPal explores launch of stock trading feature,0
Dynavax (DVAX) a COVID vaccine company you never heard of .,0
Oups 🙊,0
When the EOD expiring deep OTM option I buy expires worthless,0
$afrm... So crazy 🤪,0
Do I minimize losses or risk when buying options?,0
I sold some AMC today but why is the price at 3k? I only got 40 for each share,0
Opinions on CHWY ?,0
Wkhs is being heavily ignored right now! Don’t miss out,0
I’m 16 and have been investing since late April early May. I’ve saved up for almost two years and put it in the stock market. How am I doing?,0
I'm new and don't know what apps to use for investing in stocks,0
TPL,0
"Oil and gas slip as Hurricane Ida weakens, OPEC+ in focus",0
"Some Say Low Interest Rates Cause Inequality. What if It’s the Reverse? The Federal Reserve’s low interest rate policies and other steps meant to boost the economy are driving the value of stocks and other assets to the moon, and thus are a major cause of high wealth inequality.",0
The crevasse in China’s gaming industry widens,0
Should I consider wealth management?,0
Molina (MOH) could be a top performing stock due to positive trends,0
Aluminum Demand is SOARING while supplies still struggle to catch up,0
Kabul Airport receives missle attacks as U.S troops finish last minute withdrawals,0
$DIS OPTIONS BET ON SHANG-CHI,0
Money Held by Ally,0
Money Held by Ally Invest,0
"If you'd like to learn about stocks, crypto, pumps, options that can double your portfolio, well thought out dd and calls,or just to have fun &amp; make some good friends in an amazing community, join The Apes Of Wallstreet Discord server! Everyone is welcome!",0
senvest makes another big bet,0
hedge fund made $700m in Gamestop,0
Money Held for Six Business Days by Ally Invest,0
Question About Just Energy,0
Low risk 10x opportunity?,0
"https://bit.ly/3ju7ETu Check out this article from MarketWatch - Bitcoin Is ‘Worthless,’ Housing Bubble Billionaire Says. Just Don’t Try Betting on a Decline.",0
stuffed bears and bulls with company logos ?? Who wants one?? Got my hooded bears by my wayside,0
"Looking to buy a gaming company – Budget: $15,000 ~~ Activision Blizzard vs Electronic Arts ~~",0
Amc,0
TA during Unusual Volatility,0
"Woke up to some good little growth, any suggestions for the week ?",0
How do u learn to invest in stock,0
Feedback/suggestions needed on my portfolio. Been in the market for roughly a year now. Started last year when I was 21. Long-term everything,0
Do not buy Aterian stock before seeing this video!📈 (ATER Stock Analysis),0
Trying to save for a home.,0
Looking for some feedback/suggestions on my portfolio. Started last year when I was 21. Basically long-term on everything.,0
Astra Space Stock Drops After Launch Fails to Reach Orbit,0
New Zealand deals with first Pfizer vaccine related death. Puts on Pfizer anyone?,0
Chinese game ban,0
AVGO Earnings Possibilities,0
Here's Your Daily Market Brief For August 30th,0
"hi guys, a begginer here",0
Selling a stock to collect profits,0
Stocks to watch! Patrioticbets weekly lookout,0
$OEG ORBITAL ENERGY GROUP DD AND HURRICANE IDA DISASTER RESPONSE!,0
XETRA DOWN,0
SPRT!!!!!!,0
"My comeback 💸 I am an 18 year old guy from Canada, I just started stock trading and investing some months ago and lost money in the start because of low patience and panic buys/sells, but now I am very proud to say I’ve been able to get a good return by buying stocks at the right time📈",0
I'm watching these tickers this week for good action 👍,0
刚用这个不久，怎么聊天,0
Taking off to space #amc #gme #mmat,0
"#premarket 08/30 $BBIG - old news, $AFRM -n August 27, 2021, Affirm Holdings, Inc. issued a press release announcing that its flexible payment solution will soon be available to Amazon.com customers at checkout, $SPRT - old news, $GSAT - Apple Could Bring Satellite Communications To iPhone 13",0
What do you think of $GRPN,0
China Tech IPO in US ?????????????,0
stock,0
Stock to discuss,0
IDEX Stock Breaking its downtrend? What is IDEX support and resistance,0
ByteDance Buys Pico to Make a Foray Into VR Sector,0
Was just looking through some stocks and came across something (see comment thread),0
Simple safe investing strategies,0
“Music is the wine that fills the cup of silence.” #Celebrating pre-gain with potential future partners,0
bolt on aquisition driven oil/gas companys new ninch?,0
Silver Stocks News: Is a Reddit Silver Squeeze Targeting AG Stock? Other Mining Stocks?,0
How do skeletons in the closet after a merger affect the future stock price for Alstom (ALO)?,0
Make Money Online As A Student (300$/Month Action Plan),0
India: Xiaomi offers insurance and other financial services,0
Dollar Cost Averaging please don't ignore,0
Pie Insurance to Acquire Regional Insurer as it Evolves Into Full-Stack Carrier - Carrier Management,0
Mmat Friday close +19.36% #palikaras #shorts #hedgie #cutekitten,0
Holding 1 AMC could change your life !,0
Swiss Re links up with Climeworks to combat climate change,0
Hello community. I just want to know what are your moves for tomorrow 🚀🚀,0
What is everyones thoughts on Piedmont Lithium?,0
Helll community. I just want to know what are your moves for tomorrow 🚀🚀,0
I have been investing since January of this year and loss $800k . Wondering know， Do I need to continue trading?,0
What Are Penny Stocks And How Do They Work?,0
Honest Opinions?,0
Just started this month. What do you think of my portfolio?,0
FULL REVIEW: stock market news sentiment report 8/23-8/27,0
Is anyone seeing this too? Lol... are we about to get rich?,0
I’m 3 months old and have been investing since late June. Wondering if I’m doing good so far and any tips,0
I’m a fetus due in 3 months and have been investing since late March. Wanna know how I'm doing and looking for tips ty,0
Loss 800K in half a year，Am I still suitable for stock trading？,0
How can I gain exposure to African index or etf?,0
Should I invest in stocks or this?,0
My trusted financial advisor is r/wallstreetbets tho,0
Why are options for this stock so cheap? Am I not reading the fine print?,0
Any companies here you think I'm wrong for investing in and why?,0
Gamestop Update,0
Katapult 🚀,0
Average $CLOV investor,0
SPRT will stay on my radar this week.,0
"The ""Am i doing good?"" posts should be banned.",0
Energy Stocks expected to open higher Monday as Ida slams the Gulf of Mexico,0
cook reduced his aapl holdings by 60.6% from 8.3M down to 3.3M,0
Inflation announcement this weekend..,0
Is cathie wood a terrible stock picker? Is burry right to short her.,0
Investors needed,0
19 year mid college student. Here’s my growth portfolio!! Feedback is always welcome,0
New to this… any tips ?,0
Keep an eye on this undervalued Gem 💎,0
Invest and earn profits on Block Finance Trades,0
Why American Axle and Manufacturing (AXL) is significantly undervalued,0
I’m 15 years old and have been investing since late April. Wondering if I’m doing good so far and any tips,0
Why the hell nobody gave SPRT a chat in the last week?? 100%?? Thanks......,0
I need your help!!!,0
"John Paulson reveals everything, I mean EVERYTHING about his Big Short that made him $20 Billion during the 2008 financial crisis in this exclusive podcast interview. If you liked The Big Short movie I’m sure you’ll get a kick out of this.",0
Helmerich &amp; Payne: Undervalued Industry Leader in Innovation,0
I am 18 years old and am new to investing. These are my 3 portfolios. What are your thoughts?,0
I’m pretty new in the stock market and I’m only 15 I also have like 10 shares of amc does anyone have any advice ?,0
Full profit hello people I will ask you if you guys can help me grow on twitch and TiKTOK I want to start to stream and post stories about good entries and games having a good comunication of how is the market doing and you guys doing !!,0
"I scanned over 150 charts this weekend. Here are some good setups I found to BTFD: HOOD, CPNG, ATVI, CHWY, HD",0
Rate my portfolio?,0
I'm new and I don't know on what apps to invest,0
#AMC,0
Why $AMRN retweeted Sept Lancet issue!!!,0
Which chart would you rather buy CRWD or CSCO; CHWY or WOOF?,0
Why I am buying PHM.,0
How I played NFLX for this coming week,0
$SLQT SelectQuote stock with significant upward potential High PT of $39,0
Which chart would you rather CRWD or CSCO; CHWY or WOOF?,0
Is this really all there is to the market?,0
Is Alstom-the world's now 2nd largest rolling stock a good bet?,0
What’s everyone’s thoughts on this stock for possible long term hold? I know upstart has had much sucess. I just needed a little advice. Thanks,0
Dividend vs income etfs,0
Evogene 900% potential,0
$CLNE explosion,0
"For those who asks about China: there gonna be war conflict in several months so this dip can get dipper. The only asset that wins in that way: Silver, gold, platinum. Stay informed.",0
Jan 2020 to August 2021. Glad I didn't let the March 2020 scares get the best of me.,0
